"","AU","AF","TI","SO","SO_CO","LA","DT","DE","ID","MESH","AB","C1","CR","TC","SN","J9","JI","PY","PY_IS","VL","DI","PG","GRANT_ID","GRANT_ORG","UT","PMID","DB","AU_UN","AU_CO","AU1_CO"
"6350","LINKOVA N;KHAVINSON V;DIATLOVA A;PETUKHOV M;VLADIMIROVA E;SUKHAREVA M;ILINA A","LINKOVA, NATALIA;KHAVINSON, VLADIMIR;DIATLOVA, ANASTASIIA;PETUKHOV, MICHAEL;VLADIMIROVA, ELIZAVETA;SUKHAREVA, MARIA;ILINA, ANASTASIIA","THE INFLUENCE OF KE AND EW DIPEPTIDES IN THE COMPOSITION OF THE THYMALIN DRUG ON GENE EXPRESSION AND PROTEIN SYNTHESIS INVOLVED IN THE PATHOGENESIS OF COVID-19.","INTERNATIONAL JOURNAL OF MOLECULAR SCIENCES","SWITZERLAND","ENG","JOURNAL ARTICLE","COVID-19;EW DIPEPTIDE;KE DIPEPTIDE;THYMALIN;CYTOKINE STORM","AGED;MIDDLE AGED;HUMANS;DIPEPTIDES;TUMOR NECROSIS FACTOR-ALPHA;COVID-19;ANGIOTENSIN-CONVERTING ENZYME 2;CYTOKINE RELEASE SYNDROME;INTERLEUKIN-6;LEUKOCYTES, MONONUCLEAR;LIPOPOLYSACCHARIDES;MOLECULAR DOCKING SIMULATION;SARS-COV-2;CYTOKINES;PROTEIN BIOSYNTHESIS","AGED;MIDDLE AGED;HUMANS;DIPEPTIDES;TUMOR NECROSIS FACTOR-ALPHA;COVID-19;ANGIOTENSIN-CONVERTING ENZYME 2;CYTOKINE RELEASE SYNDROME;INTERLEUKIN-6;LEUKOCYTES, MONONUCLEAR;LIPOPOLYSACCHARIDES;MOLECULAR DOCKING SIMULATION;SARS-COV-2;CYTOKINES;PROTEIN BIOSYNTHESIS","THYMALIN IS AN IMMUNOMODULATORY DRUG CONTAINING A POLYPEPTIDE EXTRACT OF THYMUS THAT HAS DEMONSTRATED EFFICACY IN THE THERAPY OF ACUTE RESPIRATORY DISTRESS SYNDROME AND CHRONIC OBSTRUCTIVE PULMONARY DISEASE, AS WELL AS IN COMPLEX THERAPY RELATED TO SEVERE COVID-19 IN MIDDLE-AGED AND ELDERLY PATIENTS.. KE AND EW DIPEPTIDES ARE ACTIVE SUBSTANCES OF THYMALIN. THERE IS EVIDENCE THAT KE STIMULATES CELLULAR IMMUNITY AND NONSPECIFIC RESISTANCE IN ORGANISMS, EXERTING AN ACTIVATING EFFECT ON MACROPHAGES, BLOOD LYMPHOCYTES, THYMOCYTES, AND NEUTROPHILS, WHILE EW REDUCES ANGIOTENSIN-INDUCED VASOCONSTRICTION AND PRESERVES ENDOTHELIUM-DEPENDENT VASCULAR RELAXATION BY INHIBITING ACE2, THE TARGET PROTEIN OF SARS-COV-2. HOWEVER, THE MECHANISM OF THE IMMUNOMODULATORY ACTION OF THYMALIN, KE, AND EW DURING COVID-19 REMAINS UNCLEAR. TO IDENTIFY THE POTENTIAL MECHANISM OF ACTION UNDERLYING THE IMMUNOMODULATORY ACTIVITY OF THYMALIN AND ITS ACTIVE COMPONENTS, EW AND KE DIPEPTIDES, WE ASSESSED INFLAMMATORY RESPONSE IN THE CONTEXT OF COVID-19. INTERACTIONS BETWEEN EW AND KE DIPEPTIDES AND DOUBLE-STRANDED DNA (DSDNA) WERE INVESTIGATED BY MOLECULAR MODELING AND DOCKING USING ICM-PRO. ANALYSIS OF THE POSSIBLE EFFECT OF EW AND KE DIPEPTIDES ON GENE EXPRESSION AND PROTEIN SYNTHESIS INVOLVED IN THE PATHOGENESIS OF COVID-19 WAS CONDUCTED THROUGH THE USE OF BIOINFORMATICS METHODS, INCLUDING A SEARCH FOR PROMOTER SEQUENCES IN THE EUKARYOTIC PROMOTER DATABASE, THE DETERMINATION OF GENES ASSOCIATED WITH THE DEVELOPMENT OF COVID-19 USING THE PATHCARDS DATABASE OF HUMAN BIOLOGICAL PATHWAYS (PATHWAY UNIFICATION DATABASE), IDENTIFICATION OF THE RELATIONSHIP BETWEEN PROTEINS THROUGH CLUSTER ANALYSIS IN THE STRING DATABASE ('SEARCH TOOL FOR RETRIEVAL OF INTERACTING GENES/PROTEINS'), AND ASSESSMENT OF THE FUNCTIONAL ENRICHMENT OF PROTEIN-PROTEIN INTERACTION (PPI) USING THE TERMS OF GENE ONTOLOGY (GO) AND THE MARKOV CLUSTER ALGORITHM (MCL). AFTER THAT, IN VITRO STUDYING OF A LIPOPOLYSACCHARIDE (LPS)-INDUCED MODEL OF INFLAMMATION USING HUMAN PERIPHERAL BLOOD MONONUCLEAR CELLS WAS PERFORMED. ELISA WAS APPLIED TO ASSESS THE LEVEL OF CYTOKINES (IL-1Β, IL-6, TNFΑ) IN THE SUPERNATANT OF CELLS WITH OR WITHOUT THE IMPACT OF EW AND KE PEPTIDES. BLOOD SAMPLES WERE OBTAINED FROM FOUR DONORS; FOR EACH CYTOKINE, ELISA WAS PERFORMED 2-4 TIMES, WITH TWO PARALLEL EXPERIMENTAL OR CONTROL SAMPLES FOR EACH EXPERIMENT (EXPERIMENTS TO ASSESS THE EFFECTS OF PEPTIDES ON LPS-STIMULATED CELLS WERE REPEATED FOUR TIMES, WHILE ADDITIONAL EXPERIMENTS WITH UNSTIMULATED CELLS WERE PERFORMED TWO TIMES). USING MOLECULAR DOCKING, GGAG WAS FOUND TO BE THE BEST DSDNA SEQUENCE IN THE CLASSICAL B-FORM FOR BINDING THE EW DIPEPTIDE, WHILE GCGC IS THE PREFERRED DSDNA SEQUENCE IN THE CURVED NUCLEOSOMAL FORM FOR THE KE DIPEPTIDE. CLUSTER ANALYSIS REVEALED THAT POTENTIAL TARGET GENES FOR THE EW AND KE PEPTIDES ENCODE THE AKT1 AND AKT2 PROTEINS INVOLVED IN THE DEVELOPMENT OF THE CYTOKINE STORM. THE SPECIFIC TARGETS FOR THE EW PEPTIDE ARE THE   AND   GENES, AND SPECIFIC TARGET FOR THE KE PEPTIDE IS THE   GENE. PROTEIN PRODUCTS OF THE  ,  , AND   GENES ARE FUNCTIONALLY ASSOCIATED WITH IL-1Β, IL-6, TNF-Α, IL-4, AND IL-10 CYTOKINES. AN IN VITRO MODEL OF AN INFLAMMATORY REACTION DEMONSTRATED THAT THYMALIN AND EW AND KE DIPEPTIDES REDUCED THE SYNTHESIS OF IL-1Β, IL-6, AND TNF-Α CYTOKINES IN HUMAN PERIPHERAL BLOOD MONONUCLEAR CELLS BY 1.4-6.0 TIMES. THE IMMUNOMODULATORY EFFECT OF THYMALIN UNDER THE INFLAMMATORY RESPONSE CONDITIONS IN COVID-19 IS BASED ON THE POTENTIAL ABILITY OF ITS ACTIVE COMPONENTS, EW AND KE DIPEPTIDES, TO REGULATE PROTEIN SYNTHESIS INVOLVED IN THE DEVELOPMENT OF THE CYTOKINE STORM.","SAINT PETERSBURG INSTITUTE OF BIOREGULATION AND GERONTOLOGY, 197110 SAINT PETERSBURG, RUSSIA.;SAINT PETERSBURG RESEARCH INSTITUTE OF PHTHISIOPULMONOLOGY, 191036 SAINT PETERSBURG, RUSSIA.;SAINT PETERSBURG INSTITUTE OF BIOREGULATION AND GERONTOLOGY, 197110 SAINT PETERSBURG, RUSSIA.;PAVLOV INSTITUTE OF PHYSIOLOGY OF RUSSIAN ACADEMY OF SCIENCES, 199034 SAINT PETERSBURG, RUSSIA.;SAINT PETERSBURG INSTITUTE OF BIOREGULATION AND GERONTOLOGY, 197110 SAINT PETERSBURG, RUSSIA.;PETERSBURG NUCLEAR PHYSICS INSTITUTE NAMED AFTER B.P. KONSTANTINOV, NRC ""KURCHATOV INSTITUTE"", 188300 GATCHINA, RUSSIA.;FSBSI INSTITUTE OF EXPERIMENTAL MEDICINE, 197022 SAINT PETERSBURG, RUSSIA.;FSBSI INSTITUTE OF EXPERIMENTAL MEDICINE, 197022 SAINT PETERSBURG, RUSSIA.;SAINT PETERSBURG INSTITUTE OF BIOREGULATION AND GERONTOLOGY, 197110 SAINT PETERSBURG, RUSSIA.;FSBSI INSTITUTE OF EXPERIMENTAL MEDICINE, 197022 SAINT PETERSBURG, RUSSIA.","NA",0,"1422-0067","INT J MOL SCI","INT J MOL SCI",2023,"2023","24","10.3390/ijms241713377",NA,"","","37686182","37686182","PUBMED","SAINT PETERSBURG INSTITUTE OF BIOREGULATION AND GERONTOLOGY, 197110 SAINT PETERSBURG, RUSSIA.;SAINT PETERSBURG RESEARCH INSTITUTE OF PHTHISIOPULMONOLOGY, 191036 SAINT PETERSBURG, RUSSIA.;SAINT PETERSBURG INSTITUTE OF BIOREGULATION AND GERONTOLOGY, 197110 SAINT PETERSBURG, RUSSIA.;PAVLOV INSTITUTE OF PHYSIOLOGY OF RUSSIAN ACADEMY OF SCIENCES, 199034 SAINT PETERSBURG, RUSSIA.;SAINT PETERSBURG INSTITUTE OF BIOREGULATION AND GERONTOLOGY, 197110 SAINT PETERSBURG, RUSSIA.;PETERSBURG NUCLEAR PHYSICS INSTITUTE NAMED AFTER B.P. KONSTANTINOV, NRC ""KURCHATOV INSTITUTE"", 188300 GATCHINA, RUSSIA.;FSBSI INSTITUTE OF EXPERIMENTAL MEDICINE, 197022 SAINT PETERSBURG, RUSSIA.;FSBSI INSTITUTE OF EXPERIMENTAL MEDICINE, 197022 SAINT PETERSBURG, RUSSIA.;SAINT PETERSBURG INSTITUTE OF BIOREGULATION AND GERONTOLOGY, 197110 SAINT PETERSBURG, RUSSIA.;FSBSI INSTITUTE OF EXPERIMENTAL MEDICINE, 197022 SAINT PETERSBURG, RUSSIA.","NA","NA"
"3653","WANG S;ZENG J;LI P;WANG C;ZHOU A;GAO L;KONG X;LI X;YUE X;LUO J","WANG, SUFANG;ZENG, JIAN;LI, PEIRUI;WANG, CUICUI;ZHOU, AIJUAN;GAO, LONGSHENG;KONG, XIN;LI, XIAOJIAO;YUE, XIUPING;LUO, JINHONG","DISTRIBUTION CHARACTERISTICS, RISK ASSESSMENT, AND RELEVANCE WITH SURROUNDING SOIL OF HEAVY METALS IN COKING SOLID WASTES FROM COKING PLANTS IN SHANXI, CHINA.","ENVIRONMENTAL MONITORING AND ASSESSMENT","NETHERLANDS","ENG","JOURNAL ARTICLE","CHEMICAL SPECIATION;COKING PLANTS;HEAVY MENTAL POLLUTION;SOURCE ANALYSIS","HUMANS;SOIL;COKE;SOLID WASTE;CADMIUM;LEAD;SOIL POLLUTANTS;ENVIRONMENTAL MONITORING;METALS, HEAVY;RISK ASSESSMENT;SEWAGE;CHINA","HUMANS;SOIL;COKE;SOLID WASTE;CADMIUM;LEAD;SOIL POLLUTANTS;ENVIRONMENTAL MONITORING;METALS, HEAVY;RISK ASSESSMENT;SEWAGE;CHINA","HEAVY METAL CONCENTRATIONS REPRESENT IMPORTANT POLLUTION EVALUATION INDICES, AND IT IS NECESSARY TO ASSESS THE POTENTIAL ENVIRONMENTAL AND HEALTH RISKS FROM HEAVY METALS ASSOCIATED WITH COKING WASTES FROM COKING PLANTS. IN THIS STUDY, COKING SLUDGE (CS), TAR RESIDUE (TR), COKE POWDER (CP), AND SULFUR PASTE (SP) FROM THREE COKING PLANTS (PLANT A, PLANT B, AND PLANT C) IN CENTRAL, WESTERN, AND SOUTHERN SHANXI PROVINCE AND FROM SOILS SURROUNDING PLANT A WERE SELECTED AS THE RESEARCH OBJECTS, AND THE DISTRIBUTIONS OF CU, NI, PB, ZN, MN, CD, AND CR WERE DETERMINED. THE RESULTS SHOWED THAT CD IN THE FOUR SOLID WASTES FAR EXCEEDED THE SOIL BACKGROUND VALUE BY A FACTOR OF 16~195, AND THE CONTENTS OF PB IN TR (THREE PLANTS) AND CS (PLANT C) EXCEEDED THE SOIL BACKGROUND VALUES 19.70-, 23.57-, 14.46-, AND 12.56-FOLD, RESPECTIVELY. SIMILARLY, THE CONCENTRATIONS OF CU, NI, PB, ZN, AND CD IN SOILS WERE HIGHER THAN THE BACKGROUND VALUES BY FACTORS OF 31.18, 8.35, 34.79, 29.48, AND 3.43, RESPECTIVELY. IN ADDITION, THE CU, NI, PB, AND CR IN THE FOUR SOLID WASTES AND SOILS MAINLY EXISTED IN THE RESIDUAL STATE. AS DEPTH INCREASED, THE OVERALL NI, PB, MN, AND CD CONCENTRATIONS IN SOILS INCREASED. THE HIGH ECOLOGICAL RISKS ASSOCIATED WITH THE FOUR SOLID WASTES WERE MAINLY DUE TO THE ENRICHMENT OF CD. WORKERS IN COKING PLANTS FACE CERTAIN CR HEALTH RISKS. THIS STUDY PROVIDES THEORETICAL SUPPORT FOR THE COKING INDUSTRY WITH RESPECT TO THE TREATMENT, DISPOSAL, AND MANAGEMENT OF SOLID WASTES.","SHANXI ACADEMY OF ECO-ENVIRONMENTAL PLANNING AND TECHNOLOGY, 24 BEIXIAOQIANG ROAD, TAIYUAN, 030009, CHINA.;COLLEGE OF ENVIRONMENTAL SCIENCE AND ENGINEERING, TAIYUAN UNIVERSITY OF TECHNOLOGY, TAIYUAN, 030024, CHINA.;SHANXI ACADEMY OF ECO-ENVIRONMENTAL PLANNING AND TECHNOLOGY, 24 BEIXIAOQIANG ROAD, TAIYUAN, 030009, CHINA.;SHANXI ACADEMY OF ECO-ENVIRONMENTAL PLANNING AND TECHNOLOGY, 24 BEIXIAOQIANG ROAD, TAIYUAN, 030009, CHINA.;MUNICIPAL AND ENVIRONMENTAL INSTITUTE, CHINA RAILWAY SHANGHAI DESIGN INSTITUTE GROUP CO., LTD., SHANGHAI, 200040, CHINA.;COLLEGE OF ENVIRONMENTAL SCIENCE AND ENGINEERING, TAIYUAN UNIVERSITY OF TECHNOLOGY, TAIYUAN, 030024, CHINA.;COLLEGE OF ENVIRONMENTAL SCIENCE AND ENGINEERING, TAIYUAN UNIVERSITY OF TECHNOLOGY, TAIYUAN, 030024, CHINA.;SHANXI ACADEMY OF ECO-ENVIRONMENTAL PLANNING AND TECHNOLOGY, 24 BEIXIAOQIANG ROAD, TAIYUAN, 030009, CHINA.;COLLEGE OF ENVIRONMENTAL SCIENCE AND ENGINEERING, TAIYUAN UNIVERSITY OF TECHNOLOGY, TAIYUAN, 030024, CHINA.;SHANXI ACADEMY OF ECO-ENVIRONMENTAL PLANNING AND TECHNOLOGY, 24 BEIXIAOQIANG ROAD, TAIYUAN, 030009, CHINA.;COLLEGE OF ENVIRONMENTAL SCIENCE AND ENGINEERING, TAIYUAN UNIVERSITY OF TECHNOLOGY, TAIYUAN, 030024, CHINA.;COLLEGE OF ENVIRONMENTAL SCIENCE AND ENGINEERING, TAIYUAN UNIVERSITY OF TECHNOLOGY, TAIYUAN, 030024, CHINA.;SHANXI ACADEMY OF ECO-ENVIRONMENTAL PLANNING AND TECHNOLOGY, 24 BEIXIAOQIANG ROAD, TAIYUAN, 030009","NA",0,"1573-2959","ENVIRON MONIT ASSESS","ENVIRON MONIT ASSESS",2023,"2023","195","10.1007/s10661-023-11938-8","1399","","","37914972","37914972","PUBMED","SHANXI ACADEMY OF ECO-ENVIRONMENTAL PLANNING AND TECHNOLOGY, 24 BEIXIAOQIANG ROAD, TAIYUAN, 030009, CHINA.;COLLEGE OF ENVIRONMENTAL SCIENCE AND ENGINEERING, TAIYUAN UNIVERSITY OF TECHNOLOGY, TAIYUAN, 030024, CHINA.;SHANXI ACADEMY OF ECO-ENVIRONMENTAL PLANNING AND TECHNOLOGY, 24 BEIXIAOQIANG ROAD, TAIYUAN, 030009, CHINA.;SHANXI ACADEMY OF ECO-ENVIRONMENTAL PLANNING AND TECHNOLOGY, 24 BEIXIAOQIANG ROAD, TAIYUAN, 030009, CHINA.;MUNICIPAL AND ENVIRONMENTAL INSTITUTE, CHINA RAILWAY SHANGHAI DESIGN INSTITUTE GROUP CO., LTD., SHANGHAI, 200040, CHINA.;COLLEGE OF ENVIRONMENTAL SCIENCE AND ENGINEERING, TAIYUAN UNIVERSITY OF TECHNOLOGY, TAIYUAN, 030024, CHINA.;COLLEGE OF ENVIRONMENTAL SCIENCE AND ENGINEERING, TAIYUAN UNIVERSITY OF TECHNOLOGY, TAIYUAN, 030024, CHINA.;SHANXI ACADEMY OF ECO-ENVIRONMENTAL PLANNING AND TECHNOLOGY, 24 BEIXIAOQIANG ROAD, TAIYUAN, 030009, CHINA.;COLLEGE OF ENVIRONMENTAL SCIENCE AND ENGINEERING, TAIYUAN UNIVERSITY OF TECHNOLOGY, TAIYUAN, 030024, CHINA.;SHANXI ACADEMY OF ECO-ENVIRONMENTAL PLANNING AND TECHNOLOGY, 24 BEIXIAOQIANG ROAD, TAIYUAN, 030009, CHINA.;COLLEGE OF ENVIRONMENTAL SCIENCE AND ENGINEERING, TAIYUAN UNIVERSITY OF TECHNOLOGY, TAIYUAN, 030024, CHINA.;COLLEGE OF ENVIRONMENTAL SCIENCE AND ENGINEERING, TAIYUAN UNIVERSITY OF TECHNOLOGY, TAIYUAN, 030024, CHINA.;SHANXI ACADEMY OF ECO-ENVIRONMENTAL PLANNING AND TECHNOLOGY, 24 BEIXIAOQIANG ROAD, TAIYUAN, 030009","NA","NA"
"6283","HE J;JIA W;LIN Z;ZHANG Y;ZHAO Y;FANG Y","HE, JUN;JIA, WENZHE;LIN, ZIHAN;ZHANG, YIN;ZHAO, YIGUO;FANG, YAPENG","IMPROVING THE QUALITY AND PROCESSING EFFICIENCY OF BEEF JERKY VIA DRYING IN CONFINED CONDITIONS OF PRE-STRETCHING.","FOOD RESEARCH INTERNATIONAL (OTTAWA, ONT.)","CANADA","ENG","JOURNAL ARTICLE","BEEF JERKY;DRYING IN CONFINED CONDITIONS;PRE-STRETCHING;PROCESSING EFFICIENCY;TEXTURE","ANIMALS;CATTLE;ANISOTROPY;COMMERCE;DESICCATION;HYDROGELS;MUSCLE FIBERS, SKELETAL","ANIMALS;CATTLE;ANISOTROPY;COMMERCE;DESICCATION;HYDROGELS;MUSCLE FIBERS, SKELETAL","INSPIRED BY THE MECHANICAL ENHANCEMENT OF HYDROGEL VIA DRYING IN CONFINED CONDITIONS, WE APPLIED THIS STRATEGY TO BEEF JERKY MANUFACTURE FOR IMPROVING THE QUALITY AND PROCESSING EFFICIENCY. IN OUR STUDY, BEEF STRIPS WERE PRE-STRETCHED AND THEN DRIED IN A TENSILE STATE, AND THE CONFINED CONDITIONS WERE ACHIEVED BY CONTROLLING THE STRETCHED STRAINS FROM 20% TO 120%. COMPARED WITH THE SAMPLE DRIED FREELY, BEEF JERKY DRIED IN CONFINED CONDITIONS OF DIFFERENT PRE-STRETCHING STRAINS EXHIBITED IMPROVED QUALITY BASED ON TEXTURE AND SENSORY ANALYSIS. ADDITIONALLY, THIS METHOD ALSO ENHANCED PROCESSING EFFICIENCY BY REDUCING APPROXIMATELY 50% DRYING TIME. THE EXCELLENT SENSORY QUALITY AND GOOD TEXTURE OF BEEF JERKY WERE OBTAINED AS THE PRE-STRETCHING STRAIN WAS 80%. DRYING BEEF STRIPS IN CONFINED CONDITIONS MADE MUSCLE FIBERS TENSE AND ENHANCED HYDROPHOBICITY OF MYOFIBRILLAR PROTEINS, LEADING TO A COMPACT STRUCTURE WITH HIGH SHEAR FORCE AND ANISOTROPY, AND RAPID WATER LOSS IN BEEF JERKY. THIS FACILE AND GREEN METHOD PROVIDES A PROMISING ROUTE TO ENRICH THE EXISTING TECHNOLOGIES OF JERKY PROCESSING.","DEPARTMENT OF FOOD SCIENCE AND TECHNOLOGY, SCHOOL OF AGRICULTURE AND BIOLOGY, SHANGHAI JIAO TONG UNIVERSITY, SHANGHAI 200240, CHINA.;DEPARTMENT OF FOOD SCIENCE AND TECHNOLOGY, SCHOOL OF AGRICULTURE AND BIOLOGY, SHANGHAI JIAO TONG UNIVERSITY, SHANGHAI 200240, CHINA.;DEPARTMENT OF FOOD SCIENCE AND TECHNOLOGY, SCHOOL OF AGRICULTURE AND BIOLOGY, SHANGHAI JIAO TONG UNIVERSITY, SHANGHAI 200240, CHINA.;KEY LABORATORY OF MEAT PROCESSING OF SICHUAN, CHENGDU UNIVERSITY, CHENGDU 610106, CHINA.;DEPARTMENT OF FOOD SCIENCE AND TECHNOLOGY, SCHOOL OF AGRICULTURE AND BIOLOGY, SHANGHAI JIAO TONG UNIVERSITY, SHANGHAI 200240;DEPARTMENT OF FOOD SCIENCE AND TECHNOLOGY, SCHOOL OF AGRICULTURE AND BIOLOGY, SHANGHAI JIAO TONG UNIVERSITY, SHANGHAI 200240","NA",0,"1873-7145","FOOD RES INT","FOOD RES INT",2022,"2023","172","10.1016/j.foodres.2023.113171","113171","","","37689924","37689924","PUBMED","DEPARTMENT OF FOOD SCIENCE AND TECHNOLOGY, SCHOOL OF AGRICULTURE AND BIOLOGY, SHANGHAI JIAO TONG UNIVERSITY, SHANGHAI 200240, CHINA.;DEPARTMENT OF FOOD SCIENCE AND TECHNOLOGY, SCHOOL OF AGRICULTURE AND BIOLOGY, SHANGHAI JIAO TONG UNIVERSITY, SHANGHAI 200240, CHINA.;DEPARTMENT OF FOOD SCIENCE AND TECHNOLOGY, SCHOOL OF AGRICULTURE AND BIOLOGY, SHANGHAI JIAO TONG UNIVERSITY, SHANGHAI 200240, CHINA.;KEY LABORATORY OF MEAT PROCESSING OF SICHUAN, CHENGDU UNIVERSITY, CHENGDU 610106, CHINA.;DEPARTMENT OF FOOD SCIENCE AND TECHNOLOGY, SCHOOL OF AGRICULTURE AND BIOLOGY, SHANGHAI JIAO TONG UNIVERSITY, SHANGHAI 200240;DEPARTMENT OF FOOD SCIENCE AND TECHNOLOGY, SCHOOL OF AGRICULTURE AND BIOLOGY, SHANGHAI JIAO TONG UNIVERSITY, SHANGHAI 200240","NA","NA"
"5838","LEE JY;HARNEY DJ;TEO JD;KWOK JB;SUTHERLAND GT;LARANCE M;DON AS","LEE, JUN YUP;HARNEY, DYLAN J;TEO, JONATHAN D;KWOK, JOHN B;SUTHERLAND, GREG T;LARANCE, MARK;DON, ANTHONY S","THE MAJOR TMEM106B DEMENTIA RISK ALLELE AFFECTS TMEM106B PROTEIN LEVELS, FIBRIL FORMATION, AND MYELIN LIPID HOMEOSTASIS IN THE AGEING HUMAN HIPPOCAMPUS.","MOLECULAR NEURODEGENERATION","ENGLAND","ENG","JOURNAL ARTICLE","AGEING;LIPIDOMIC;MYELIN;NEURODEGENERATION;PROTEOMIC;SPHINGOLIPID;TMEM106B;HIPPOCAMPUS","HUMANS;ALLELES;MYELIN SHEATH;PROTEOME;PROTEOMICS;CYTOSKELETON;HIPPOCAMPUS;AGING;ALZHEIMER DISEASE;HOMEOSTASIS;LIPIDS;APOLIPOPROTEINS E;MEMBRANE PROTEINS;NERVE TISSUE PROTEINS","HUMANS;ALLELES;MYELIN SHEATH;PROTEOME;PROTEOMICS;CYTOSKELETON;HIPPOCAMPUS;AGING;ALZHEIMER DISEASE;HOMEOSTASIS;LIPIDS;APOLIPOPROTEINS E;MEMBRANE PROTEINS;NERVE TISSUE PROTEINS","THE RISK FOR DEMENTIA INCREASES EXPONENTIALLY FROM THE SEVENTH DECADE OF LIFE. IDENTIFYING AND UNDERSTANDING THE BIOCHEMICAL CHANGES THAT SENSITIZE THE AGEING BRAIN TO NEURODEGENERATION WILL PROVIDE NEW OPPORTUNITIES FOR DEMENTIA PREVENTION AND TREATMENT. THIS STUDY AIMED TO DETERMINE HOW AGEING AND MAJOR GENETIC RISK FACTORS FOR DEMENTIA AFFECT THE HIPPOCAMPAL PROTEOME AND LIPIDOME OF NEUROLOGICALLY-NORMAL HUMANS OVER THE AGE OF 65. THE HIPPOCAMPUS WAS CHOSEN AS IT IS HIGHLY SUSCEPTIBLE TO ATROPHY WITH AGEING AND IN SEVERAL NEURODEGENERATIVE DISEASES. MASS SPECTROMETRY-BASED PROTEOMIC AND LIPIDOMIC ANALYSIS OF CA1 HIPPOCAMPUS SAMPLES FROM 74 NEUROLOGICALLY NORMAL HUMAN DONORS, AGED 66-104, WAS USED IN COMBINATION WITH MULTIPLE REGRESSION MODELS AND GENE SET ENRICHMENT ANALYSIS TO IDENTIFY AGE-DEPENDENT CHANGES IN THE PROTEOME AND LIPIDOME. ANOVA WAS USED TO TEST THE EFFECT OF MAJOR DEMENTIA RISK ALLELES IN THE TMEM106B AND APOE GENES ON THE HIPPOCAMPAL PROTEOME AND LIPIDOME, ADJUSTING FOR AGE, GENDER, AND POST-MORTEM INTERVAL. FIBRILLAR C-TERMINAL TMEM106B FRAGMENTS WERE ISOLATED USING SARKOSYL FRACTIONATION AND QUANTIFIED BY IMMUNOBLOTTING. FORTY PROTEINS WERE ASSOCIATED WITH AGE AT FALSE DISCOVERY RATE-CORRECTED P < 0.05, INCLUDING PROTEINS THAT REGULATE CELL ADHESION, THE CYTOSKELETON, AMINO ACID AND LIPID METABOLISM, AND RIBOSOMAL SUBUNITS. TMEM106B, A REGULATOR OF LYSOSOMAL AND OLIGODENDROCYTE FUNCTION, WAS REGULATED WITH GREATEST EFFECT SIZE. THE INCREASE IN TMEM106B LEVELS WITH AGEING WAS SPECIFIC TO CARRIERS OF THE RS1990622-A ALLELE IN THE TMEM106B GENE THAT INCREASES RISK FOR FRONTOTEMPORAL DEMENTIA, ALZHEIMER'S DISEASE, PARKINSON'S DISEASE, AND HIPPOCAMPAL SCLEROSIS WITH AGEING. RS1990622-A WAS ALSO ASSOCIATED WITH HIGHER TMEM106B FIBRIL CONTENT. HIPPOCAMPAL LIPIDS WERE NOT SIGNIFICANTLY AFFECTED BY APOE GENOTYPE, HOWEVER LEVELS OF MYELIN-ENRICHED SULFATIDES AND HEXOSYLCERAMIDES WERE SIGNIFICANTLY LOWER, AND POLYUNSATURATED PHOSPHOLIPIDS WERE HIGHER, IN RS1990622-A CARRIERS AFTER CONTROLLING FOR APOE GENOTYPE. OUR STUDY DEMONSTRATES THAT TMEM106B PROTEIN ABUNDANCE IS INCREASED WITH BRAIN AGEING IN HUMANS, ESTABLISHES THAT DEMENTIA RISK ALLELE RS1990622-A PREDISPOSES TO TMEM106B FIBRIL FORMATION IN THE HIPPOCAMPUS, AND PROVIDES THE FIRST EVIDENCE THAT RS1990622-A AFFECTS BRAIN LIPID HOMEOSTASIS, PARTICULARLY MYELIN LIPIDS. OUR DATA SUGGESTS THAT TMEM106B IS ONE OF A GROWING LIST OF MAJOR DEMENTIA RISK GENES THAT AFFECT GLIAL LIPID METABOLISM.","CHARLES PERKINS CENTRE, CAMPERDOWN, NSW, 2006, AUSTRALIA.;SCHOOL OF MEDICAL SCIENCES, CAMPERDOWN, NSW, 2006, AUSTRALIA.;CHARLES PERKINS CENTRE, CAMPERDOWN, NSW, 2006, AUSTRALIA.;SCHOOL OF MEDICAL SCIENCES, CAMPERDOWN, NSW, 2006, AUSTRALIA.;CHARLES PERKINS CENTRE, CAMPERDOWN, NSW, 2006, AUSTRALIA.;SCHOOL OF MEDICAL SCIENCES, CAMPERDOWN, NSW, 2006, AUSTRALIA.;SCHOOL OF MEDICAL SCIENCES, CAMPERDOWN, NSW, 2006, AUSTRALIA.;BRAIN AND MIND CENTRE, THE UNIVERSITY OF SYDNEY, CAMPERDOWN, NSW, 2006, AUSTRALIA.;CHARLES PERKINS CENTRE, CAMPERDOWN, NSW, 2006, AUSTRALIA.;SCHOOL OF MEDICAL SCIENCES, CAMPERDOWN, NSW, 2006, AUSTRALIA.;CHARLES PERKINS CENTRE, CAMPERDOWN, NSW, 2006, AUSTRALIA.;SCHOOL OF MEDICAL SCIENCES, CAMPERDOWN, NSW, 2006, AUSTRALIA.;CHARLES PERKINS CENTRE, CAMPERDOWN, NSW, 2006","NA",0,"1750-1326","MOL NEURODEGENER","MOL NEURODEGENER",2022,"2023","18","10.1186/s13024-023-00650-3","63","","","37726834","37726834","PUBMED","CHARLES PERKINS CENTRE, CAMPERDOWN, NSW, 2006, AUSTRALIA.;SCHOOL OF MEDICAL SCIENCES, CAMPERDOWN, NSW, 2006, AUSTRALIA.;CHARLES PERKINS CENTRE, CAMPERDOWN, NSW, 2006, AUSTRALIA.;SCHOOL OF MEDICAL SCIENCES, CAMPERDOWN, NSW, 2006, AUSTRALIA.;CHARLES PERKINS CENTRE, CAMPERDOWN, NSW, 2006, AUSTRALIA.;SCHOOL OF MEDICAL SCIENCES, CAMPERDOWN, NSW, 2006, AUSTRALIA.;SCHOOL OF MEDICAL SCIENCES, CAMPERDOWN, NSW, 2006, AUSTRALIA.;BRAIN AND MIND CENTRE, THE UNIVERSITY OF SYDNEY, CAMPERDOWN, NSW, 2006, AUSTRALIA.;CHARLES PERKINS CENTRE, CAMPERDOWN, NSW, 2006, AUSTRALIA.;SCHOOL OF MEDICAL SCIENCES, CAMPERDOWN, NSW, 2006, AUSTRALIA.;CHARLES PERKINS CENTRE, CAMPERDOWN, NSW, 2006, AUSTRALIA.;SCHOOL OF MEDICAL SCIENCES, CAMPERDOWN, NSW, 2006, AUSTRALIA.;CHARLES PERKINS CENTRE, CAMPERDOWN, NSW, 2006","NA","NA"
"4408","YUAN D;HUANG B;GU M;QIN BE;SU Z;DAI K;PENG FH;JIANG Y","YUAN, DASEN;HUANG, BIHUI;GU, MEIFENG;QIN, BANG-E;SU, ZHIHUI;DAI, KAI;PENG, FU-HUA;JIANG, YING","EXPLORING SHARED GENETIC SIGNATURES OF ALZHEIMER'S DISEASE AND MULTIPLE SCLEROSIS: A BIOINFORMATIC ANALYSIS STUDY.","EUROPEAN NEUROLOGY","SWITZERLAND","ENG","JOURNAL ARTICLE","ALZHEIMER’S DISEASE;BIOINFORMATICS;DIFFERENTIALLY EXPRESSED GENES;HUB GENE;MULTIPLE SCLEROSIS","HUMANS;ALZHEIMER DISEASE;MULTIPLE SCLEROSIS;MICRORNAS;COMPUTATIONAL BIOLOGY;DATABASES, FACTUAL","HUMANS;ALZHEIMER DISEASE;MULTIPLE SCLEROSIS;MICRORNAS;COMPUTATIONAL BIOLOGY;DATABASES, FACTUAL","MANY CLINICAL STUDIES REPORTED THE COEXISTENCE OF ALZHEIMER'S DISEASE (AD) AND MULTIPLE SCLEROSIS (MS), BUT THE COMMON MOLECULAR SIGNATURE BETWEEN AD AND MS REMAINS ELUSIVE. THE PURPOSE OF OUR STUDY WAS TO EXPLORE THE GENETIC LINKAGE BETWEEN AD AND MS THROUGH BIOINFORMATIC ANALYSIS, PROVIDING NEW INSIGHTS INTO THE SHARED SIGNATURES AND POSSIBLE PATHOGENESIS OF TWO DISEASES. THE COMMON DIFFERENTIALLY EXPRESSED GENES (DEGS) WERE DETERMINED BETWEEN AD AND MS FROM DATASETS OBTAINED FROM GENE EXPRESSION OMNIBUS (GEO) DATABASE. FURTHER, FUNCTIONAL AND PATHWAY ENRICHMENT ANALYSIS, PROTEIN-PROTEIN INTERACTION NETWORK CONSTRUCTION, AND IDENTIFICATION OF HUB GENES WERE CARRIED OUT. THE EXPRESSION LEVEL OF HUB GENES WAS VALIDATED IN TWO OTHER EXTERNAL AD AND MS DATASETS. TRANSCRIPTION FACTOR (TF)-GENE INTERACTIONS AND GENE-MIRNA INTERACTIONS WERE PERFORMED IN NETWORKANALYST. FINALLY, RECEIVER OPERATING CHARACTERISTIC (ROC) CURVE ANALYSIS WAS APPLIED TO EVALUATE THE PREDICTIVE VALUE OF HUB GENES. A TOTAL OF 75 COMMON DEGS WERE IDENTIFIED BETWEEN AD AND MS. FUNCTIONAL AND PATHWAY ENRICHMENT ANALYSIS EMPHASIZED THE IMPORTANCE OF EXOCYTOSIS AND SYNAPTIC VESICLE CYCLE, RESPECTIVELY. SIX SIGNIFICANT HUB GENES, INCLUDING CCL2, CD44, GFAP, NEFM, STXBP1, AND TCEAL6, WERE IDENTIFIED AND VERIFIED AS COMMON HUB GENES SHARED BY AD AND MS. FOXC1 AND HSA-MIR-16-5P ARE THE MOST COMMON TF AND MIRNA IN REGULATING HUB GENES, RESPECTIVELY. IN THE ROC CURVE ANALYSIS, ALL HUB GENES SHOWED GOOD EFFICIENCY IN HELPING DISTINGUISH PATIENTS FROM CONTROLS. OUR STUDY FIRST IDENTIFIED A COMMON GENETIC SIGNATURE BETWEEN AD AND MS, PAVING THE ROAD FOR INVESTIGATING SHARED MECHANISM OF AD AND MS.","DEPARTMENT OF NEUROLOGY, THE THIRD AFFILIATED HOSPITAL, SUN YAT-SEN UNIVERSITY, GUANGZHOU, CHINA.;SCIENTIFIC RESEARCH CENTER, THE SEVENTH AFFILIATED HOSPITAL OF SUN YAT-SEN UNIVERSITY, SHENZHEN, CHINA.;DEPARTMENT OF NEUROLOGY, THE THIRD AFFILIATED HOSPITAL, SUN YAT-SEN UNIVERSITY, GUANGZHOU, CHINA.;DEPARTMENT OF NEUROLOGY, THE THIRD AFFILIATED HOSPITAL, SUN YAT-SEN UNIVERSITY, GUANGZHOU, CHINA.;DEPARTMENT OF NEUROLOGY, THE THIRD AFFILIATED HOSPITAL, SUN YAT-SEN UNIVERSITY, GUANGZHOU, CHINA.;DEPARTMENT OF NEUROLOGY, THE THIRD AFFILIATED HOSPITAL, SUN YAT-SEN UNIVERSITY, GUANGZHOU, CHINA.;DEPARTMENT OF NEUROLOGY, THE THIRD AFFILIATED HOSPITAL, SUN YAT-SEN UNIVERSITY, GUANGZHOU, CHINA.;DEPARTMENT OF NEUROLOGY, THE THIRD AFFILIATED HOSPITAL, SUN YAT-SEN UNIVERSITY, GUANGZHOU, CHINA.","NA",0,"1421-9913","EUR NEUROL","EUR NEUROL",2023,"2023","86","10.1159/000533397","363-376","","","37848007","37848007","PUBMED","DEPARTMENT OF NEUROLOGY, THE THIRD AFFILIATED HOSPITAL, SUN YAT-SEN UNIVERSITY, GUANGZHOU, CHINA.;SCIENTIFIC RESEARCH CENTER, THE SEVENTH AFFILIATED HOSPITAL OF SUN YAT-SEN UNIVERSITY, SHENZHEN, CHINA.;DEPARTMENT OF NEUROLOGY, THE THIRD AFFILIATED HOSPITAL, SUN YAT-SEN UNIVERSITY, GUANGZHOU, CHINA.;DEPARTMENT OF NEUROLOGY, THE THIRD AFFILIATED HOSPITAL, SUN YAT-SEN UNIVERSITY, GUANGZHOU, CHINA.;DEPARTMENT OF NEUROLOGY, THE THIRD AFFILIATED HOSPITAL, SUN YAT-SEN UNIVERSITY, GUANGZHOU, CHINA.;DEPARTMENT OF NEUROLOGY, THE THIRD AFFILIATED HOSPITAL, SUN YAT-SEN UNIVERSITY, GUANGZHOU, CHINA.;DEPARTMENT OF NEUROLOGY, THE THIRD AFFILIATED HOSPITAL, SUN YAT-SEN UNIVERSITY, GUANGZHOU, CHINA.;DEPARTMENT OF NEUROLOGY, THE THIRD AFFILIATED HOSPITAL, SUN YAT-SEN UNIVERSITY, GUANGZHOU, CHINA.","NA","NA"
