"","AU","AF","TI","SO","SO_CO","LA","DT","DE","ID","MESH","AB","C1","CR","TC","SN","J9","JI","PY","PY_IS","VL","DI","PG","GRANT_ID","GRANT_ORG","UT","PMID","DB","AU_UN","AU_CO","AU1_CO"
"4557","KONG T;FAN X;TRAN NT","KONG, TONGTONG;FAN, XINYUE;TRAN, NGOC TUAN",NA,"ANIMALS : AN OPEN ACCESS JOURNAL FROM MDPI","SWITZERLAND","ENG","JOURNAL ARTICLE","AEROMONAS HYDROPHILA;ERIOCHEIR SINENSIS;STAPHYLOCOCCUS AUREUS;HEMOLYMPH MICROBIOTA","","","THE CHINESE MITTEN CRAB ( ) HAS SIGNIFICANT ECONOMIC POTENTIAL IN BOTH THE CHINESE DOMESTIC AND GLOBAL MARKETS. THE HEMOLYMPH MICROBIOTA IS KNOWN TO PLAY A CRITICAL ROLE IN REGULATING PHYSIOLOGICAL AND BIOCHEMICAL FUNCTIONS IN CRUSTACEANS. HOWEVER, THE STUDY OF THE HEMOLYMPH MICROBIOTA OF   IN RESPONSE TO INFECTIONS HAS NOT BEEN UNDERTAKEN. IN THIS STUDY, CHANGES IN THE COMPOSITION AND FUNCTION OF THE HEMOLYMPH MICROBIOTA IN   INFECTED WITH EITHER   (SA) OR   (AH) WERE INVESTIGATED USING 16S RRNA SEQUENCING, WITH A PHOSPHATE BUFFER SALINE (PBS) INJECTION SERVING AS THE CONTROL. RESULTS SHOWED THAT THE DOMINANT HEMOLYMPH MICROBIOTA OF   WERE PROTEOBACTERIA, BACTEROIDOTA, AND FIRMICUTES. THE RELATIVE ABUNDANCE OF THE PHYLA FIRMICUTES, BDELLOVIBRIONOTA, AND MYXOCOCCOTA WAS SIGNIFICANTLY REDUCED IN BOTH SA AND AH GROUPS COMPARED TO THE PBS GROUP. AT THE GENUS LEVEL, COMPARED TO THE PBS GROUP, A SIGNIFICANT INCREASE IN THE ABUNDANCE OF   AND   WAS FOUND IN BOTH AH AND SA GROUPS. THE ANALYSIS OF THE FUNCTIONAL PROFILE SHOWED THAT PATHWAYS RELATED TO 'CELL GROWTH AND DEATH', 'METABOLISM OF TERPENOIDS AND POLYKETIDES', 'CANCERS', 'LIPID METABOLISM', 'NEURODEGENERATIVE DISEASES', 'METABOLISM OF OTHER AMINO ACIDS', 'XENOBIOTICS BIODEGRADATION AND METABOLISM', AND 'CIRCULATORY SYSTEM AND ENDOCRINE SYSTEM' WERE PREDOMINANT IN THE AH GROUP. MEANWHILE, PATHWAYS RELATED TO 'METABOLISM OR GENETIC INFORMATION PROGRESSING', SUCH AS 'TRANSLATION', 'METABOLIC DISEASES', AND 'CELLULAR PROCESSES AND SIGNALING', WERE ENRICHED IN THE SA GROUP. THIS STUDY REVEALED THE EFFECTS OF PATHOGENS (  OR  ) ON THE MAINTENANCE OF THE HEMOLYMPH MICROBIOTA IN  . IT SHED LIGHT ON THE MECHANISMS EMPLOYED BY THE HEMOLYMPH MICROBIOTA OF   UNDER PATHOGEN STIMULATION.","SCHOOL OF LIFE SCIENCES, QUFU NORMAL UNIVERSITY, QUFU 273165, CHINA.;SCHOOL OF LIFE SCIENCES, QUFU NORMAL UNIVERSITY, QUFU 273165, CHINA.;GUANGDONG PROVINCIAL KEY LABORATORY OF MARINE BIOLOGY, SHANTOU UNIVERSITY, SHANTOU 515063, CHINA.;INSTITUTE OF MARINE SCIENCES, SHANTOU UNIVERSITY, SHANTOU 515063, CHINA.","NA",0,"2076-2615","ANIMALS (BASEL)","ANIMALS (BASEL)",2023,"2023","13","10.3390/ani13193058",NA,"32202981;NTF21027;2022ZDZX4007","NATIONAL NATURAL SCIENCE FOUNDATION OF CHINA;STU SCIENTIFIC RESEARCH FOUNDATION FOR TALENTS;SPECIAL PROJECTS IN KEY FIELDS OF GENERAL UNIVERSITIES IN GUANGDONG PROVINCE","37835665","37835665","PUBMED","SCHOOL OF LIFE SCIENCES, QUFU NORMAL UNIVERSITY, QUFU 273165, CHINA.;SCHOOL OF LIFE SCIENCES, QUFU NORMAL UNIVERSITY, QUFU 273165, CHINA.;GUANGDONG PROVINCIAL KEY LABORATORY OF MARINE BIOLOGY, SHANTOU UNIVERSITY, SHANTOU 515063, CHINA.;INSTITUTE OF MARINE SCIENCES, SHANTOU UNIVERSITY, SHANTOU 515063, CHINA.","NA","NA"
"9971","YI S;FENG Y;WANG Y;MA F","YI, SHIQI;FENG, YING;WANG, YAN;MA, FANG","SIALYLATION: FATE DECISION OF MAMMALIAN SPERM DEVELOPMENT, FERTILIZATION, AND MALE FERTILITY†.","BIOLOGY OF REPRODUCTION","UNITED STATES","ENG","REVIEW","CAPACITATION;FERTILIZATION;IMMUNE EVASION;MALE FERTILITY;MALE INFERTILITY;SIALYLATION;SPERM MATURATION","ANIMALS;MALE;HUMANS;FEMALE;SPERM MATURATION;SEMEN;SPERMATOZOA;INFERTILITY, MALE;MAMMALS;FERTILIZATION;FERTILITY;SPERM CAPACITATION","ANIMALS;MALE;HUMANS;FEMALE;SPERM MATURATION;SEMEN;SPERMATOZOA;INFERTILITY, MALE;MAMMALS;FERTILIZATION;FERTILITY;SPERM CAPACITATION","SPERM DEVELOPMENT, MATURATION, AND SUCCESSFUL FERTILIZATION WITHIN THE FEMALE REPRODUCTIVE TRACT ARE INTRICATE AND ORDERLY PROCESSES THAT INVOLVE PROTEIN TRANSLATION AND POST-TRANSLATIONAL MODIFICATIONS. AMONG THESE MODIFICATIONS, SIALYLATION PLAYS A CRUCIAL ROLE. ANY DISRUPTIONS OCCURRING THROUGHOUT THE SPERM'S LIFE CYCLE CAN RESULT IN MALE INFERTILITY, YET OUR CURRENT UNDERSTANDING OF THIS PROCESS REMAINS LIMITED. CONVENTIONAL SEMEN ANALYSIS OFTEN FAILS TO DIAGNOSE SOME INFERTILITY CASES ASSOCIATED WITH SPERM SIALYLATION, EMPHASIZING THE NEED TO COMPREHEND AND INVESTIGATE THE CHARACTERISTICS OF SPERM SIALYLATION. THIS REVIEW REANALYZES THE SIGNIFICANCE OF SIALYLATION IN SPERM DEVELOPMENT AND FERTILIZATION AND EVALUATES THE IMPACT OF SIALYLATION DAMAGE ON MALE FERTILITY UNDER PATHOLOGICAL CONDITIONS. SIALYLATION SERVES A VITAL ROLE IN THE LIFE JOURNEY OF SPERM, PROVIDING A NEGATIVELY CHARGED GLYCOCALYX AND ENRICHING THE MOLECULAR STRUCTURE OF THE SPERM SURFACE, WHICH IS BENEFICIAL TO SPERM REVERSIBLE RECOGNITION AND IMMUNE INTERACTION. THESE CHARACTERISTICS ARE PARTICULARLY CRUCIAL DURING SPERM MATURATION AND FERTILIZATION WITHIN THE FEMALE REPRODUCTIVE TRACT. MOREOVER, ENHANCING THE UNDERSTANDING OF THE MECHANISM UNDERLYING SPERM SIALYLATION CAN PROMOTE THE DEVELOPMENT OF RELEVANT CLINICAL INDICATORS FOR INFERTILITY DETECTION AND TREATMENT.","CENTER FOR TRANSLATIONAL MEDICINE, KEY LABORATORY OF BIRTH DEFECTS AND RELATED DISEASES OF WOMEN AND CHILDREN (SICHUAN UNIVERSITY), MINISTRY OF EDUCATION, WEST CHINA SECOND UNIVERSITY HOSPITAL, SICHUAN UNIVERSITY, CHENGDU, SICHUAN, P.R. CHINA.;DEPARTMENT OF OBSTETRICS AND GYNECOLOGY, WEST CHINA SECOND HOSPITAL, SICHUAN UNIVERSITY, CHENGDU, SICHUAN, CHINA.;WEST CHINA SCHOOL OF BASIC MEDICAL SCIENCES & FORENSIC MEDICINE, SICHUAN UNIVERSITY, CHENGDU, SICHUAN, CHINA.;DEPARTMENT OF OBSTETRICS AND GYNECOLOGY, WEST CHINA SECOND HOSPITAL, SICHUAN UNIVERSITY, CHENGDU, SICHUAN, CHINA.;CENTER FOR TRANSLATIONAL MEDICINE, KEY LABORATORY OF BIRTH DEFECTS AND RELATED DISEASES OF WOMEN AND CHILDREN (SICHUAN UNIVERSITY), MINISTRY OF EDUCATION, WEST CHINA SECOND UNIVERSITY HOSPITAL, SICHUAN UNIVERSITY, CHENGDU, SICHUAN, P.R. CHINA.;DEPARTMENT OF OBSTETRICS AND GYNECOLOGY, WEST CHINA SECOND HOSPITAL, SICHUAN UNIVERSITY, CHENGDU, SICHUAN, CHINA.","NA",0,"1529-7268","BIOL REPROD","BIOL REPROD",2023,"2023","109","10.1093/biolre/ioad067","137-155","","","37379321","37379321","PUBMED","CENTER FOR TRANSLATIONAL MEDICINE, KEY LABORATORY OF BIRTH DEFECTS AND RELATED DISEASES OF WOMEN AND CHILDREN (SICHUAN UNIVERSITY), MINISTRY OF EDUCATION, WEST CHINA SECOND UNIVERSITY HOSPITAL, SICHUAN UNIVERSITY, CHENGDU, SICHUAN, P.R. CHINA.;DEPARTMENT OF OBSTETRICS AND GYNECOLOGY, WEST CHINA SECOND HOSPITAL, SICHUAN UNIVERSITY, CHENGDU, SICHUAN, CHINA.;WEST CHINA SCHOOL OF BASIC MEDICAL SCIENCES & FORENSIC MEDICINE, SICHUAN UNIVERSITY, CHENGDU, SICHUAN, CHINA.;DEPARTMENT OF OBSTETRICS AND GYNECOLOGY, WEST CHINA SECOND HOSPITAL, SICHUAN UNIVERSITY, CHENGDU, SICHUAN, CHINA.;CENTER FOR TRANSLATIONAL MEDICINE, KEY LABORATORY OF BIRTH DEFECTS AND RELATED DISEASES OF WOMEN AND CHILDREN (SICHUAN UNIVERSITY), MINISTRY OF EDUCATION, WEST CHINA SECOND UNIVERSITY HOSPITAL, SICHUAN UNIVERSITY, CHENGDU, SICHUAN, P.R. CHINA.;DEPARTMENT OF OBSTETRICS AND GYNECOLOGY, WEST CHINA SECOND HOSPITAL, SICHUAN UNIVERSITY, CHENGDU, SICHUAN, CHINA.","NA","NA"
"7515","JIA ZC;LI YQ;ZHOU BW;XIA QC;WANG PX;WANG XX;SUN ZG;GUO Y","JIA, ZHI-CHENG;LI, YONG-QIAN;ZHOU, BO-WEN;XIA, QING-CHANG;WANG, PEI-XUAN;WANG, XIAO-XUAN;SUN, ZHEN-GAO;GUO, YING","TRANSCRIPTOMIC PROFILING OF HUMAN GRANULOSA CELLS BETWEEN WOMEN WITH ADVANCED MATERNAL AGE WITH DIFFERENT OVARIAN RESERVE.","JOURNAL OF ASSISTED REPRODUCTION AND GENETICS","NETHERLANDS","ENG","JOURNAL ARTICLE","ADVANCED MATERNAL AGE;DIMINISHED OVARIAN RESERVE;FERROPTOSIS;GRANULOSA CELLS;OVARIAN AGING;TRANSCRIPTOMIC PROFILING","PREGNANCY;HUMANS;FEMALE;TRANSCRIPTOME;MATERNAL AGE;OVARIAN RESERVE;GENE EXPRESSION PROFILING;GRANULOSA CELLS;OVARIAN DISEASES","PREGNANCY;HUMANS;FEMALE;TRANSCRIPTOME;MATERNAL AGE;OVARIAN RESERVE;GENE EXPRESSION PROFILING;GRANULOSA CELLS;OVARIAN DISEASES","AGE-RELATED DIMINISHED OVARIAN RESERVE (DOR) IS NOT ABSOLUTE. SOME ADVANCED MATERNAL AGE (AMA) STILL HAVE NORMAL OVARIAN RESERVE (NOR) AND OFTEN SHOW BETTER PREGNANCY OUTCOMES. EXPLORING THE TRANSCRIPTOMIC PROFILE OF GRANULOSA CELLS (GCS) IN AMA COULD LEAD TO NEW IDEAS FOR MITIGATING AGE-RELATED DIMINISHED OVARIAN RESERVE. THIS STUDY AIMED TO ANALYZE THE TRANSCRIPTOMIC PROFILE OF GCS IN AMA WITH DIFFERENT OVARIAN RESERVE. IN TOTAL, 6273 STATISTICALLY SIGNIFICANT DIFFERENTIAL EXPRESSION GENES (DEGS) (|LOG2FC|> 1, Q < 0.05) WERE SCREENED FROM THE TWO GROUPS, AMONG WHICH 3436 GENES WERE UPREGULATED, AND 2837 GENES WERE DOWNREGULATED IN THE DOR GROUP. THROUGH GENE ONTOLOGY (GO) AND KYOTO ENCYCLOPEDIA OF GENES AND GENOMES (KEGG) PATHWAY ENRICHMENT ANALYSIS, THE POTENTIAL FUNCTIONS OF DYSREGULATED GENES IN AMA WITH DOR OR NOR WERE PREDICTED. THE GO ENRICHMENT ANALYSIS REVEALED THAT THE DEGS WERE MAINLY ENRICHED IN OBSOLETE OXIDATION-REDUCTION PROCESS, MITOCHONDRION, METAL ION BINDING, ATP BINDING, ETC. THE KEGG PATHWAY ENRICHMENT ANALYSIS REVEALED THAT THE ABOVE-MENTIONED DEGS WERE MAINLY ENRICHED IN FERROPTOSIS, REGULATION OF ACTIN CYTOSKELETON, OXIDATIVE PHOSPHORYLATION, ETC. MEANWHILE, VERIFICATION OF THE MRNA EXPRESSION LEVELS OF DEGS REVEALED THE POSSIBLE INVOLVEMENT OF ""FERROPTOSIS"" IN AGE-RELATED DIMINISHED OVARIAN RESERVE. FROM A NEW CLINICAL PERSPECTIVE, WE PRESENTED THE FIRST DATA SHOWING THE TRANSCRIPTOMIC PROFILE IN GCS BETWEEN AMA WITH DIFFERENT OVARIAN RESERVE. AT THE SAME TIME, WE IDENTIFIED THE ROLE OF FERROPTOSIS IN THE GCS OF AMA, PROVIDING A NEW BIOLOGICAL BASIS FOR STUDYING OVARIAN AGING AND IMPROVING PREGNANCY OUTCOMES OF AMA.","THE FIRST CLINICAL COLLEGE, SHANDONG UNIVERSITY OF TRADITIONAL CHINESE MEDICINE, JINAN, CHINA.;COLLEGE OF TRADITIONAL CHINESE MEDICINE, SHANDONG UNIVERSITY OF TRADITIONAL CHINESE MEDICINE, JINAN, CHINA.;THE FIRST CLINICAL COLLEGE, SHANDONG UNIVERSITY OF TRADITIONAL CHINESE MEDICINE, JINAN, CHINA.;THE FIRST CLINICAL COLLEGE, SHANDONG UNIVERSITY OF TRADITIONAL CHINESE MEDICINE, JINAN, CHINA.;THE FIRST CLINICAL COLLEGE, SHANDONG UNIVERSITY OF TRADITIONAL CHINESE MEDICINE, JINAN, CHINA.;REPRODUCTIVE AND GENETIC CENTER OF INTEGRATIVE MEDICINE, AFFILIATED HOSPITAL OF SHANDONG UNIVERSITY OF TRADITIONAL CHINESE MEDICINE, JINAN, CHINA.;THE FIRST CLINICAL COLLEGE, SHANDONG UNIVERSITY OF TRADITIONAL CHINESE MEDICINE, JINAN, CHINA.;COLLEGE OF TRADITIONAL CHINESE MEDICINE, SHANDONG UNIVERSITY OF TRADITIONAL CHINESE MEDICINE, JINAN, CHINA.;REPRODUCTIVE AND GENETIC CENTER OF INTEGRATIVE MEDICINE, AFFILIATED HOSPITAL OF SHANDONG UNIVERSITY OF TRADITIONAL CHINESE MEDICINE, JINAN, CHINA.;THE FIRST CLINICAL COLLEGE, SHANDONG UNIVERSITY OF TRADITIONAL CHINESE MEDICINE, JINAN;COLLEGE OF TRADITIONAL CHINESE MEDICINE, SHANDONG UNIVERSITY OF TRADITIONAL CHINESE MEDICINE, JINAN;REPRODUCTIVE AND GENETIC CENTER OF INTEGRATIVE MEDICINE, AFFILIATED HOSPITAL OF SHANDONG UNIVERSITY OF TRADITIONAL CHINESE MEDICINE, JINAN","NA",0,"1573-7330","J ASSIST REPROD GENET","J ASSIST REPROD GENET",2023,"2023","40","10.1007/s10815-023-02915-8","2427-2437","ZR2023MH219;81804130;202225005;TSQN 202211353","NATURAL SCIENCE FOUNDATION OF SHANDONG PROVINCE;NATURAL SCIENCE FOUNDATION OF CHINA;SCIENCE AND TECHNOLOGY PLAN PROJECT OF JINAN;TAISHAN SCHOLAR FOUNDATION OF SHANDONG PROVINCE","37589858","37589858","PUBMED","THE FIRST CLINICAL COLLEGE, SHANDONG UNIVERSITY OF TRADITIONAL CHINESE MEDICINE, JINAN, CHINA.;COLLEGE OF TRADITIONAL CHINESE MEDICINE, SHANDONG UNIVERSITY OF TRADITIONAL CHINESE MEDICINE, JINAN, CHINA.;THE FIRST CLINICAL COLLEGE, SHANDONG UNIVERSITY OF TRADITIONAL CHINESE MEDICINE, JINAN, CHINA.;THE FIRST CLINICAL COLLEGE, SHANDONG UNIVERSITY OF TRADITIONAL CHINESE MEDICINE, JINAN, CHINA.;THE FIRST CLINICAL COLLEGE, SHANDONG UNIVERSITY OF TRADITIONAL CHINESE MEDICINE, JINAN, CHINA.;REPRODUCTIVE AND GENETIC CENTER OF INTEGRATIVE MEDICINE, AFFILIATED HOSPITAL OF SHANDONG UNIVERSITY OF TRADITIONAL CHINESE MEDICINE, JINAN, CHINA.;THE FIRST CLINICAL COLLEGE, SHANDONG UNIVERSITY OF TRADITIONAL CHINESE MEDICINE, JINAN, CHINA.;COLLEGE OF TRADITIONAL CHINESE MEDICINE, SHANDONG UNIVERSITY OF TRADITIONAL CHINESE MEDICINE, JINAN, CHINA.;REPRODUCTIVE AND GENETIC CENTER OF INTEGRATIVE MEDICINE, AFFILIATED HOSPITAL OF SHANDONG UNIVERSITY OF TRADITIONAL CHINESE MEDICINE, JINAN, CHINA.;THE FIRST CLINICAL COLLEGE, SHANDONG UNIVERSITY OF TRADITIONAL CHINESE MEDICINE, JINAN;COLLEGE OF TRADITIONAL CHINESE MEDICINE, SHANDONG UNIVERSITY OF TRADITIONAL CHINESE MEDICINE, JINAN;REPRODUCTIVE AND GENETIC CENTER OF INTEGRATIVE MEDICINE, AFFILIATED HOSPITAL OF SHANDONG UNIVERSITY OF TRADITIONAL CHINESE MEDICINE, JINAN","NA","NA"
"3776","KAUR B;KUMAR S;KAUR A;GOEL RK","KAUR, BALDEEP;KUMAR, SANDEEP;KAUR, ARVINDER;GOEL, RAJESH KUMAR",NA,"IN SILICO PHARMACOLOGY","GERMANY","ENG","JOURNAL ARTICLE","A. RACEMOSUS.;COGNITION IMPAIRMENT;EPILEPSY;NETWORK PHARMACOLOGY","","","NETWORK PHARMACOLOGY APPROACH HAS BEEN OBSERVED A POWERFUL TOOL TO PREDICT UNDERLYING COMPLEX PHARMACOLOGICAL MECHANISM OF HERBS.   HAS BEEN REPORTED TO SHOW AMELIORATIVE EFFECTS IN TREATING EPILEPSY AND COMORBID MEMORY DYSFUNCTION BUT MECHANISM OF THIS AMELIORATION IS ELUSIVE. HENCE A NETWORK PHARMACOLOGY APPROACH WAS EMPLOYED TO INVESTIGATE THE PLAUSIBLE MECHANISM OF  .  . : BIOACTIVE COMPOUNDS OF   WERE EXTRACTED BASED ON THE TCMSP, PCIDB, AND BATMAN-TCM DATABASE. THE POTENTIAL TARGETS OF BIOACTIVE COMPOUNDS WERE COLLECTED USING TARGET FISHING. EPILEPSY AND COMORBID DEMENTIA GENES WERE COLLECTED FROM DISGENET. A PPI NETWORK AMONG THESE TARGETS WAS CONSTRUCTED USING THE INTERSECTING KEY TARGETS BETWEEN HERB TARGETS AND DISEASE TARGETS. BESIDES, DAVID BIOINFORMATICS RESOURCE WAS UTILIZED FOR THE PATHWAY ENRICHMENT ANALYSIS ON GO AND KEGG. ULTIMATELY, PHYTOCHEMICAL COMPOUND-TARGET GENES-PATHWAYS NETWORK HAS BEEN ASSEMBLED UTILIZING CYTOSCAPE TO DECIPHER THE MECHANISM OF THE HERB. THE NETWORK ANALYSIS REVEALED THAT 5 TARGETS (CASP3, TNF, VEGFA, PTGS2 AND CNR1) MIGHT BE THE KEY THERAPEUTIC TARGETS OF ASPARAGUS ON EPILEPSY COMORBID ALZHEIMER'S DISEASE. BASED ON HIGH CONNECTIVITY, FOUR HUB COMPOUNDS WITH THE HIGHEST CONNECTIVITY WERE NOTED AND IT INCLUDES SHATAVARIN V, SARSASAPOGENIN, SHATAVARIN IX, AND SHATAVARIN VI. A TOTAL OF 19 KEGG TERMS WERE ENRICHED AS THE POTENTIAL PATHWAYS OF   IN EPILEPSY COMORBID ALZHEIMER'S DISEASE. THIS STUDY ENVISAGED THE PHARMACOLOGICAL AND MOLECULAR MECHANISM OF   AGAINST EPILEPSY COMORBID ALZHEIMER'S DISEASE AND PUT FORWARD A STRATEGY TO UNCOVER THE MECHANISMS OF TRADITIONAL INDIAN MEDICINE BASED ON NETWORK PHARMACOLOGY. THE ONLINE VERSION CONTAINS SUPPLEMENTARY MATERIAL AVAILABLE AT 10.1007/S40203-023-00169-X.","DEPARTMENT OF PHARMACEUTICAL SCIENCES AND DRUG RESEARCH, PUNJABI UNIVERSITY, PATIALA, PUNJAB 147002 INDIA.;DEPARTMENT OF PHARMACOLOGY, M. M. COLLEGE OF PHARMACY, M. M. (DEEMED TO BE UNIVERSITY), MULLANA, AMBALA, HARYANA INDIA.;DEPARTMENT OF PHARMACEUTICAL SCIENCES AND DRUG RESEARCH, PUNJABI UNIVERSITY, PATIALA, PUNJAB 147002 INDIA.;DEPARTMENT OF PHARMACEUTICAL SCIENCES AND DRUG RESEARCH, PUNJABI UNIVERSITY, PATIALA, PUNJAB 147002 INDIA.","NA",0,"2193-9616","IN SILICO PHARMACOL","IN SILICO PHARMACOL",2023,"2023","11","10.1007/s40203-023-00169-x","29","","","37899966","37899966","PUBMED","DEPARTMENT OF PHARMACEUTICAL SCIENCES AND DRUG RESEARCH, PUNJABI UNIVERSITY, PATIALA, PUNJAB 147002 INDIA.;DEPARTMENT OF PHARMACOLOGY, M. M. COLLEGE OF PHARMACY, M. M. (DEEMED TO BE UNIVERSITY), MULLANA, AMBALA, HARYANA INDIA.;DEPARTMENT OF PHARMACEUTICAL SCIENCES AND DRUG RESEARCH, PUNJABI UNIVERSITY, PATIALA, PUNJAB 147002 INDIA.;DEPARTMENT OF PHARMACEUTICAL SCIENCES AND DRUG RESEARCH, PUNJABI UNIVERSITY, PATIALA, PUNJAB 147002 INDIA.","NA","NA"
"2294","BARNETT MM;REAY WR;GEAGHAN MP;KILTSCHEWSKIJ DJ;GREEN MJ;WEIDENHOFER J;GLATT SJ;CAIRNS MJ","BARNETT, MICHELLE M;REAY, WILLIAM R;GEAGHAN, MICHAEL P;KILTSCHEWSKIJ, DYLAN J;GREEN, MELISSA J;WEIDENHOFER, JUDITH;GLATT, STEPHEN J;CAIRNS, MURRAY J","MIRNA CARGO IN CIRCULATING VESICLES FROM NEURONS IS ALTERED IN INDIVIDUALS WITH SCHIZOPHRENIA AND ASSOCIATED WITH SEVERE DISEASE.","SCIENCE ADVANCES","UNITED STATES","ENG","JOURNAL ARTICLE","","HUMANS;MICRORNAS;SCHIZOPHRENIA;NEURONS;EXTRACELLULAR VESICLES;BRAIN DISEASES","HUMANS;MICRORNAS;SCHIZOPHRENIA;NEURONS;EXTRACELLULAR VESICLES;BRAIN DISEASES","WHILE RNA EXPRESSION APPEARS TO BE ALTERED IN SEVERAL BRAIN DISORDERS, THE CONSTRAINTS OF POSTMORTEM ANALYSIS MAKE IT IMPRACTICAL FOR WELL-POWERED POPULATION STUDIES AND BIOMARKER DEVELOPMENT. GIVEN THAT THE UNIQUE MOLECULAR COMPOSITION OF NEURONS ARE REFLECTED IN THEIR EXTRACELLULAR VESICLES (EVS), WE HYPOTHESIZED THAT THE FRACTIONATION OF NEURON DERIVED EVS PROVIDES AN OPPORTUNITY TO SPECIFICALLY PROFILE THEIR ENCAPSULATED CONTENTS NONINVASIVELY FROM BLOOD. TO INVESTIGATE THIS HYPOTHESIS, WE DETERMINED MIRNA EXPRESSION IN MICROTUBULE ASSOCIATED PROTEIN 1B (MAP1B)-ENRICHED SERUM EVS DERIVED FROM NEURONS FROM A LARGE COHORT OF INDIVIDUALS WITH SCHIZOPHRENIA AND NONPSYCHIATRIC COMPARISON PARTICIPANTS. WE OBSERVED DYSREGULATION OF MIRNA IN SCHIZOPHRENIA SUBJECTS, IN PARTICULAR THOSE WITH TREATMENT-RESISTANCE AND SEVERE COGNITIVE DEFICITS. THESE DATA SUPPORT THE HYPOTHESIS THAT SCHIZOPHRENIA IS ASSOCIATED WITH ALTERATIONS IN POSTTRANSCRIPTIONAL REGULATION OF SYNAPTIC GENE EXPRESSION AND PROVIDES AN EXAMPLE OF THE POTENTIAL UTILITY OF TISSUE-SPECIFIC EV ANALYSIS IN BRAIN DISORDERS.","SCHOOL OF BIOMEDICAL SCIENCES AND PHARMACY, FACULTY OF HEALTH AND MEDICINE, THE UNIVERSITY OF NEWCASTLE, CALLAGHAN, NSW 2308, AUSTRALIA.;PRECISION MEDICINE RESEARCH PROGRAM, HUNTER MEDICAL RESEARCH INSTITUTE, NEWCASTLE, NSW 2305, AUSTRALIA.;SCHOOL OF BIOMEDICAL SCIENCES AND PHARMACY, FACULTY OF HEALTH AND MEDICINE, THE UNIVERSITY OF NEWCASTLE, CALLAGHAN, NSW 2308, AUSTRALIA.;PRECISION MEDICINE RESEARCH PROGRAM, HUNTER MEDICAL RESEARCH INSTITUTE, NEWCASTLE, NSW 2305, AUSTRALIA.;KINGHORN CENTRE FOR CLINICAL GENOMICS, GARVAN MEDICAL RESEARCH INSTITUTE, DARLINGHURST, NSW 2010, AUSTRALIA.;SCHOOL OF BIOMEDICAL SCIENCES AND PHARMACY, FACULTY OF HEALTH AND MEDICINE, THE UNIVERSITY OF NEWCASTLE, CALLAGHAN, NSW 2308, AUSTRALIA.;PRECISION MEDICINE RESEARCH PROGRAM, HUNTER MEDICAL RESEARCH INSTITUTE, NEWCASTLE, NSW 2305, AUSTRALIA.;DISCIPLINE OF PSYCHIATRY AND MENTAL HEALTH, SCHOOL OF CLINICAL MEDICINE, UNIVERSITY OF NEW SOUTH WALES, SYDNEY, NSW 2052, AUSTRALIA.;NEUROSCIENCE RESEARCH AUSTRALIA, SYDNEY, NSW, AUSTRALIA.;SCHOOL OF BIOMEDICAL SCIENCES AND PHARMACY, FACULTY OF HEALTH AND MEDICINE, THE UNIVERSITY OF NEWCASTLE, CALLAGHAN, NSW 2308, AUSTRALIA.;PSYCHIATRIC GENETIC EPIDEMIOLOGY AND NEUROBIOLOGY LABORATORY (PSYCHGENE LAB), DEPARTMENT OF PSYCHIATRY AND BEHAVIORAL SCIENCES, SUNY UPSTATE MEDICAL UNIVERSITY, SYRACUSE, NY, USA.;SCHOOL OF BIOMEDICAL SCIENCES AND PHARMACY, FACULTY OF HEALTH AND MEDICINE, THE UNIVERSITY OF NEWCASTLE, CALLAGHAN, NSW 2308, AUSTRALIA.;PRECISION MEDICINE RESEARCH PROGRAM, HUNTER MEDICAL RESEARCH INSTITUTE, NEWCASTLE, NSW 2305, AUSTRALIA.","NA",0,"2375-2548","SCI ADV","SCI ADV",2023,"2023","9","10.1126/sciadv.adi4386","EADI4386","","","38019909","38019909","PUBMED","SCHOOL OF BIOMEDICAL SCIENCES AND PHARMACY, FACULTY OF HEALTH AND MEDICINE, THE UNIVERSITY OF NEWCASTLE, CALLAGHAN, NSW 2308, AUSTRALIA.;PRECISION MEDICINE RESEARCH PROGRAM, HUNTER MEDICAL RESEARCH INSTITUTE, NEWCASTLE, NSW 2305, AUSTRALIA.;SCHOOL OF BIOMEDICAL SCIENCES AND PHARMACY, FACULTY OF HEALTH AND MEDICINE, THE UNIVERSITY OF NEWCASTLE, CALLAGHAN, NSW 2308, AUSTRALIA.;PRECISION MEDICINE RESEARCH PROGRAM, HUNTER MEDICAL RESEARCH INSTITUTE, NEWCASTLE, NSW 2305, AUSTRALIA.;KINGHORN CENTRE FOR CLINICAL GENOMICS, GARVAN MEDICAL RESEARCH INSTITUTE, DARLINGHURST, NSW 2010, AUSTRALIA.;SCHOOL OF BIOMEDICAL SCIENCES AND PHARMACY, FACULTY OF HEALTH AND MEDICINE, THE UNIVERSITY OF NEWCASTLE, CALLAGHAN, NSW 2308, AUSTRALIA.;PRECISION MEDICINE RESEARCH PROGRAM, HUNTER MEDICAL RESEARCH INSTITUTE, NEWCASTLE, NSW 2305, AUSTRALIA.;DISCIPLINE OF PSYCHIATRY AND MENTAL HEALTH, SCHOOL OF CLINICAL MEDICINE, UNIVERSITY OF NEW SOUTH WALES, SYDNEY, NSW 2052, AUSTRALIA.;NEUROSCIENCE RESEARCH AUSTRALIA, SYDNEY, NSW, AUSTRALIA.;SCHOOL OF BIOMEDICAL SCIENCES AND PHARMACY, FACULTY OF HEALTH AND MEDICINE, THE UNIVERSITY OF NEWCASTLE, CALLAGHAN, NSW 2308, AUSTRALIA.;PSYCHIATRIC GENETIC EPIDEMIOLOGY AND NEUROBIOLOGY LABORATORY (PSYCHGENE LAB), DEPARTMENT OF PSYCHIATRY AND BEHAVIORAL SCIENCES, SUNY UPSTATE MEDICAL UNIVERSITY, SYRACUSE, NY, USA.;SCHOOL OF BIOMEDICAL SCIENCES AND PHARMACY, FACULTY OF HEALTH AND MEDICINE, THE UNIVERSITY OF NEWCASTLE, CALLAGHAN, NSW 2308, AUSTRALIA.;PRECISION MEDICINE RESEARCH PROGRAM, HUNTER MEDICAL RESEARCH INSTITUTE, NEWCASTLE, NSW 2305, AUSTRALIA.","NA","NA"
