"","AU","AF","TI","SO","SO_CO","LA","DT","DE","ID","MESH","AB","C1","CR","TC","SN","J9","JI","PY","PY_IS","VL","DI","PG","GRANT_ID","GRANT_ORG","UT","PMID","DB","AU_UN","AU_CO","AU1_CO"
"3692","YIN ML;ZHAO SP;LAI JL;YANG X;DONG B;ZHU YB;ZHANG Y","YIN, MAO-LING;ZHAO, SAN-PING;LAI, JIN-LONG;YANG, XU;DONG, BIN;ZHU, YONG-BING;ZHANG, YU","OXYGEN-INSENSITIVE NITROREDUCTASE BACTERIA-MEDIATED DEGRADATION OF TNT AND PROTEOMIC ANALYSIS.","ENVIRONMENTAL SCIENCE AND POLLUTION RESEARCH INTERNATIONAL","GERMANY","ENG","JOURNAL ARTICLE","2,4,6-TRINITROTOLUENE;MICROBIAL DEGRADATION;NITROREDUCTASE;PROTEOMICS","TRINITROTOLUENE;PROTEOMICS;NITROREDUCTASES;BACTERIA;BIODEGRADATION, ENVIRONMENTAL;SOIL","TRINITROTOLUENE;PROTEOMICS;NITROREDUCTASES;BACTERIA;BIODEGRADATION, ENVIRONMENTAL;SOIL","2,4,6-TRINITROTOLUENE (TNT) IS A NITROAROMATIC COMPOUND THAT CAUSES SOIL AND GROUNDWATER POLLUTION DURING MANUFACTURE, TRANSPORTATION, AND USE, POSING SIGNIFICANT ENVIRONMENTAL AND SAFETY HAZARDS. IN THIS STUDY, A TNT-DEGRADING STRAIN, BACILLUS CEREUS STRAIN T4, WAS SCREENED AND ISOLATED FROM TNT-CONTAMINATED SOIL TO EXPLORE ITS DEGRADATION CHARACTERISTICS AND PROTEOMIC RESPONSE TO TNT. THE RESULTS SHOWED THAT AFTER INOCULATION WITH THE BACTERIA FOR 4 H, THE TNT DEGRADATION RATE REACHED 100% AND WAS TRANSFORMED INTO 2-AMINO-4,6-DINITROTOLUENE (2-ADNT), 4-AMINO-2,6-DINITROTOLUENE (4-ADNT), 2,4-DIAMINO-6-NITROTOLUENE (2,4-DANT), AND 2,6-DIAMINO-4-NITROTOLUENE (2,6-DANT), ACCOMPANIED BY THE ACCUMULATION OF NITRITE AND AMMONIUM IONS. THROUGH PROTEOMIC SEQUENCING, WE IDENTIFIED 999 DIFFERENTIALLY EXPRESSED PROTEINS (482 UPREGULATED, 517 DOWNREGULATED), MAINLY ENRICHED IN THE PENTOSE PHOSPHATE, GLYCOLYSIS/GLUCONEOGENESIS, AND AMINO ACID METABOLISM PATHWAYS. IN ADDITION, THE SIGNIFICANT UPREGULATION OF NITROREDUCTASE AND N-ETHYLMALEIMIDE REDUCTASE WAS CLOSELY RELATED TO TNT DENITRATION AND CONFIRMED THAT THE STRAIN T4 CONVERTED TNT INTO INTERMEDIATE METABOLITES SUCH AS 2-ADNT AND 4-ADNT. THEREFORE, BACILLUS CEREUS STRAIN T4 HAS THE POTENTIAL TO DEGRADE TNT AND HAS A HIGH TOLERANCE TO INTERMEDIATE PRODUCTS, WHICH MAY EFFECTIVELY DEGRADE NITROAROMATIC POLLUTANTS SUCH AS TNT IN SITU REMEDIATION IN COMBINATION WITH OTHER BACTERIAL COMMUNITIES.","STATE KEY LABORATORY OF NBC PROTECTION FOR CIVILIAN, BEIJING, 102205, CHINA.;SCHOOL OF LIFE SCIENCE AND ENGINEERING, SOUTHWEST UNIVERSITY OF SCIENCE AND TECHNOLOGY, MIANYANG, 621010, CHINA.;STATE KEY LABORATORY OF NBC PROTECTION FOR CIVILIAN, BEIJING, 102205;STATE KEY LABORATORY OF NBC PROTECTION FOR CIVILIAN, BEIJING, 102205, CHINA.;STATE KEY LABORATORY OF NBC PROTECTION FOR CIVILIAN, BEIJING, 102205, CHINA.;STATE KEY LABORATORY OF NBC PROTECTION FOR CIVILIAN, BEIJING, 102205, CHINA.;STATE KEY LABORATORY OF NBC PROTECTION FOR CIVILIAN, BEIJING, 102205, CHINA.;SCHOOL OF LIFE SCIENCE AND ENGINEERING, SOUTHWEST UNIVERSITY OF SCIENCE AND TECHNOLOGY, MIANYANG, 621010, CHINA.","NA",0,"1614-7499","ENVIRON SCI POLLUT RES INT","ENVIRON SCI POLLUT RES INT",2023,"2023","30","10.1007/s11356-023-30568-8","116227-116238","22176222, 22106182;ZQ2021-01","INNOVATIVE RESEARCH GROUP PROJECT OF THE NATIONAL NATURAL SCIENCE FOUNDATION OF CHINA;THE OUTSTANDING TALENT PROGRAM OF THE ACADEMY OF MILITARY SCIENCES","37907824","37907824","PUBMED","STATE KEY LABORATORY OF NBC PROTECTION FOR CIVILIAN, BEIJING, 102205, CHINA.;SCHOOL OF LIFE SCIENCE AND ENGINEERING, SOUTHWEST UNIVERSITY OF SCIENCE AND TECHNOLOGY, MIANYANG, 621010, CHINA.;STATE KEY LABORATORY OF NBC PROTECTION FOR CIVILIAN, BEIJING, 102205;STATE KEY LABORATORY OF NBC PROTECTION FOR CIVILIAN, BEIJING, 102205, CHINA.;STATE KEY LABORATORY OF NBC PROTECTION FOR CIVILIAN, BEIJING, 102205, CHINA.;STATE KEY LABORATORY OF NBC PROTECTION FOR CIVILIAN, BEIJING, 102205, CHINA.;STATE KEY LABORATORY OF NBC PROTECTION FOR CIVILIAN, BEIJING, 102205, CHINA.;SCHOOL OF LIFE SCIENCE AND ENGINEERING, SOUTHWEST UNIVERSITY OF SCIENCE AND TECHNOLOGY, MIANYANG, 621010, CHINA.","NA","NA"
"310","DAI W;ZHENG P;WU J;CHEN S;DENG M;TONG X;LIU F;SHANG X;QIAN K","DAI, WEI;ZHENG, PING;WU, JIAN;CHEN, SIQI;DENG, MINGTAO;TONG, XIANGQIAN;LIU, FEN;SHANG, XIULING;QIAN, KEJIAN","INTEGRATED ANALYSIS OF SINGLE-CELL RNA-SEQ AND CHIPSET DATA UNRAVELS PANOPTOSIS-RELATED GENES IN SEPSIS.","FRONTIERS IN IMMUNOLOGY","SWITZERLAND","ENG","JOURNAL ARTICLE","BORUTA ALGORITHM;PANOPTOSIS;SEPSIS;SINGLE-CELL RNA-SEQ;SSGSEA","HUMANS;SINGLE-CELL GENE EXPRESSION ANALYSIS;SEPSIS;ALGORITHMS;B-LYMPHOCYTES;CELL TRANSFORMATION, NEOPLASTIC","HUMANS;SINGLE-CELL GENE EXPRESSION ANALYSIS;SEPSIS;ALGORITHMS;B-LYMPHOCYTES;CELL TRANSFORMATION, NEOPLASTIC","THE POOR PROGNOSIS OF SEPSIS WARRANTS THE INVESTIGATION OF BIOMARKERS FOR PREDICTING THE OUTCOME. SEVERAL STUDIES HAVE INDICATED THAT PANOPTOSIS EXERTS A CRITICAL ROLE IN TUMOR INITIATION AND DEVELOPMENT. NEVERTHELESS, THE ROLE OF PANOPTOSIS IN SEPSIS HAS NOT BEEN FULLY ELUCIDATED. WE OBTAINED SEPSIS SAMPLES AND SCRNA-SEQ DATA FROM THE GEO DATABASE. PANOPTOSIS-RELATED GENES WERE SUBJECTED TO CONSENSUS CLUSTERING AND FUNCTIONAL ENRICHMENT ANALYSIS, FOLLOWED BY IDENTIFICATION OF DIFFERENTIALLY EXPRESSED GENES AND CALCULATION OF THE PANOPTOSIS SCORE. A PANOPTOSIS-BASED PROGNOSTIC MODEL WAS DEVELOPED.   EXPERIMENTS WERE PERFORMED TO VERIFY DISTINCT PANOPTOSIS-RELATED GENES. AN EXTERNAL SCRNA-SEQ DATASET WAS USED TO VERIFY CELLULAR LOCALIZATION. UNSUPERVISED CLUSTERING ANALYSIS USING 16 PANOPTOSIS-RELATED GENES IDENTIFIED THREE SUBTYPES OF SEPSIS. KAPLAN-MEIER ANALYSIS SHOWED SIGNIFICANT DIFFERENCES IN PATIENT SURVIVAL AMONG THE SUBTYPES, WITH DIFFERENT IMMUNE INFILTRATION LEVELS. DIFFERENTIAL ANALYSIS OF THE SUBTYPES IDENTIFIED 48 DEGS. BORUTA ALGORITHM PCA ANALYSIS IDENTIFIED 16 DEGS AS PANOPTOSIS-RELATED SIGNATURE GENES. WE DEVELOPED PANSCORE BASED ON THESE SIGNATURE GENES, WHICH CAN DISTINGUISH DIFFERENT PANOPTOSIS AND CLINICAL CHARACTERISTICS AND MAY SERVE AS A POTENTIAL BIOMARKER. SINGLE-CELL SEQUENCING ANALYSIS IDENTIFIED SIX CELL TYPES, WITH HIGH PANSCORE CLUSTERING RELATIVELY IN B CELLS, AND LOW PANSCORE IN CD16+ AND CD14+ MONOCYTES AND MEGAKARYOCYTE PROGENITORS. ZBP1, XAF1, IFI44L, SOCS1, AND PARP14 WERE RELATIVELY HIGHER IN CELLS WITH HIGH PANSCORE. WE DEVELOPED A MACHINE LEARNING BASED BORUTA ALGORITHM FOR PROFILING PANOPTOSIS RELATED SUBGROUPS WITH IN PREDICTING SURVIVAL AND CLINICAL FEATURES IN THE SEPSIS.","DEPARTMENT OF INTENSIVE CARE UNIT, THE FIRST AFFILIATED HOSPITAL OF JIANGXI MEDICAL COLLEGE, SHANGRAO, JIANGXI, CHINA.;DEPARTMENT OF CLINICAL MEDICINE, JIANGXI MEDICAL COLLEGE, SHANGRAO, JIANGXI, CHINA.;DEPARTMENT OF KEY LABORATORY, SHANGHAI PUDONG NEW AREA PEOPLE'S HOSPITAL, SHANGHAI, CHINA.;DEPARTMENT OF MEDICAL TECHNOLOGY, JIANGXI MEDICAL COLLEGE, SHANGRAO, JIANGXI, CHINA.;DEPARTMENT OF MEDICAL TECHNOLOGY, JIANGXI MEDICAL COLLEGE, SHANGRAO, JIANGXI, CHINA.;DEPARTMENT OF MEDICAL TECHNOLOGY, JIANGXI MEDICAL COLLEGE, SHANGRAO, JIANGXI, CHINA.;DEPARTMENT OF INTENSIVE CARE UNIT, THE FIRST AFFILIATED HOSPITAL OF JIANGXI MEDICAL COLLEGE, SHANGRAO, JIANGXI, CHINA.;DEPARTMENT OF INTENSIVE CARE UNIT, THE FIRST AFFILIATED HOSPITAL OF NANCHANG UNIVERSITY, NANCHANG, JIANGXI, CHINA.;THE THIRD DEPARTMENT OF CRITICAL CARE MEDICINE, SHENGLI CLINICAL MEDICAL COLLEGE OF FUJIAN MEDICAL UNIVERSITY, FUJIAN PROVINCIAL CENTER FOR CRITICAL CARE MEDICINE, FUJIAN PROVINCIAL KEY LABORATORY OF CRITICAL CARE MEDICINE, FUZHOU, CHINA.;DEPARTMENT OF INTENSIVE CARE UNIT, THE FIRST AFFILIATED HOSPITAL OF NANCHANG UNIVERSITY, NANCHANG, JIANGXI, CHINA.","NA",0,"1664-3224","FRONT IMMUNOL","FRONT IMMUNOL",2023,"2023","14","10.3389/fimmu.2023.1247131","1247131","","","38239341","38239341","PUBMED","DEPARTMENT OF INTENSIVE CARE UNIT, THE FIRST AFFILIATED HOSPITAL OF JIANGXI MEDICAL COLLEGE, SHANGRAO, JIANGXI, CHINA.;DEPARTMENT OF CLINICAL MEDICINE, JIANGXI MEDICAL COLLEGE, SHANGRAO, JIANGXI, CHINA.;DEPARTMENT OF KEY LABORATORY, SHANGHAI PUDONG NEW AREA PEOPLE'S HOSPITAL, SHANGHAI, CHINA.;DEPARTMENT OF MEDICAL TECHNOLOGY, JIANGXI MEDICAL COLLEGE, SHANGRAO, JIANGXI, CHINA.;DEPARTMENT OF MEDICAL TECHNOLOGY, JIANGXI MEDICAL COLLEGE, SHANGRAO, JIANGXI, CHINA.;DEPARTMENT OF MEDICAL TECHNOLOGY, JIANGXI MEDICAL COLLEGE, SHANGRAO, JIANGXI, CHINA.;DEPARTMENT OF INTENSIVE CARE UNIT, THE FIRST AFFILIATED HOSPITAL OF JIANGXI MEDICAL COLLEGE, SHANGRAO, JIANGXI, CHINA.;DEPARTMENT OF INTENSIVE CARE UNIT, THE FIRST AFFILIATED HOSPITAL OF NANCHANG UNIVERSITY, NANCHANG, JIANGXI, CHINA.;THE THIRD DEPARTMENT OF CRITICAL CARE MEDICINE, SHENGLI CLINICAL MEDICAL COLLEGE OF FUJIAN MEDICAL UNIVERSITY, FUJIAN PROVINCIAL CENTER FOR CRITICAL CARE MEDICINE, FUJIAN PROVINCIAL KEY LABORATORY OF CRITICAL CARE MEDICINE, FUZHOU, CHINA.;DEPARTMENT OF INTENSIVE CARE UNIT, THE FIRST AFFILIATED HOSPITAL OF NANCHANG UNIVERSITY, NANCHANG, JIANGXI, CHINA.","NA","NA"
"2648","FU R;LIU H;ZHANG Y;MAO L;ZHU L;JIANG H;ZHANG L;LIU X","FU, RUIQIANG;LIU, HONGLI;ZHANG, YANNING;MAO, LIANGANG;ZHU, LIZHEN;JIANG, HONGYUN;ZHANG, LAN;LIU, XINGANG","IMIDACLOPRID AFFECTS THE VISUAL BEHAVIOR OF ADULT ZEBRAFISH (DANIO RERIO) BY MEDIATING THE EXPRESSION OF OPSIN AND PHOTOTRANSDUCTION GENES AND ALTERING THE METABOLISM OF NEUROTRANSMITTERS.","THE SCIENCE OF THE TOTAL ENVIRONMENT","NETHERLANDS","ENG","JOURNAL ARTICLE","NEUROTRANSMITTERS;OPSINS;OPTOKINETIC RESPONSE;OPTOMOTOR RESPONSE;RETINA","ANIMALS;OPSINS;ZEBRAFISH;ECOSYSTEM;RETINA;LIGHT SIGNAL TRANSDUCTION;WATER POLLUTANTS, CHEMICAL","ANIMALS;OPSINS;ZEBRAFISH;ECOSYSTEM;RETINA;LIGHT SIGNAL TRANSDUCTION;WATER POLLUTANTS, CHEMICAL","IMIDACLOPRID POSES A SIGNIFICANT THREAT TO AQUATIC ECOSYSTEMS. IN THIS STUDY, WE INVESTIGATED THE VISUAL TOXICITY OF IMIDACLOPRID AND THE UNDERLYING MOLECULAR MECHANISMS IN ADULT ZEBRAFISH. AFTER EXPOSURE TO IMIDACLOPRID AT ENVIRONMENTAL RELEVANT CONCENTRATIONS (10 AND 100ΜG/L) FOR 21 DAYS, THE DETECTABLE CONTENTS OF IMIDACLOPRID WERE 23.0 ± 0.80 AND 121 ± 1.56 NG/MG IN EYES OF ADULT ZEBRAFISH, RESPECTIVELY. THE VISUAL BEHAVIOR OF ADULT ZEBRAFISH WAS IMPAIRED INCLUDING A REDUCED ABILITY TO TRACK SMOOTHLY VISUAL STIMULI AND VISUALLY GUIDED SELF-MOTION. THE IMMUNOFLUORESCENCE EXPERIMENT SHOWED THAT THE CONTENT OF RHODOPSIN (RHO) IN THE RETINA OF ZEBRAFISH WAS CHANGED SIGNIFICANTLY. THE EXPRESSION RHYTHM OF GENES PLAYED KEY ROLES IN CAPTURING PHOTONS IN DIM (RHO) AND BRIGHT (OPN1MW3, OPN1LW2 AND OPN1SW2) LIGHT, AND IN PHOTOTRANSDUCTION (GNB3B, ARR3A AND RPE65A), WAS DISRUPTED SIGNIFICANTLY THROUGHOUT A 24-H PERIOD IN ADULT ZEBRAFISH. TARGETED METABOLOMICS ANALYSIS SHOWED THAT THE CONTENT OF 16 METABOLITES ASSOCIATED WITH NEUROTRANSMITTER FUNCTION CHANGED SIGNIFICANTLY, AND WERE ENRICHED IN TOP THREE METABOLISM PATHWAYS INCLUDING ARGININE BIOSYNTHESIS, ALANINE, ASPARTATE AND GLUTAMATE METABOLISM, AND TRYPTOPHAN METABOLISM. THESE RESULTS INDICATED THAT IMIDACLOPRID EXPOSURE AT ENVIRONMENTALLY RELEVANT CONCENTRATIONS COULD CAUSE OPTICAL TOXICITY THROUGH DISTURBING THE EXPRESSION OF OPSINS AND AFFECTING THE PHOTOTRANSDUCTION IN THE RETINA OF ZEBRAFISH ADULTS.","STATE KEY LABORATORY FOR BIOLOGY OF PLANT DISEASES AND INSECT PESTS, INSTITUTE OF PLANT PROTECTION, CHINESE ACADEMY OF AGRICULTURAL SCIENCES, BEIJING 100193, CHINA.;STATE KEY LABORATORY FOR BIOLOGY OF PLANT DISEASES AND INSECT PESTS, INSTITUTE OF PLANT PROTECTION, CHINESE ACADEMY OF AGRICULTURAL SCIENCES, BEIJING 100193, CHINA.;STATE KEY LABORATORY FOR BIOLOGY OF PLANT DISEASES AND INSECT PESTS, INSTITUTE OF PLANT PROTECTION, CHINESE ACADEMY OF AGRICULTURAL SCIENCES, BEIJING 100193, CHINA.;STATE KEY LABORATORY FOR BIOLOGY OF PLANT DISEASES AND INSECT PESTS, INSTITUTE OF PLANT PROTECTION, CHINESE ACADEMY OF AGRICULTURAL SCIENCES, BEIJING 100193, CHINA.;STATE KEY LABORATORY FOR BIOLOGY OF PLANT DISEASES AND INSECT PESTS, INSTITUTE OF PLANT PROTECTION, CHINESE ACADEMY OF AGRICULTURAL SCIENCES, BEIJING 100193, CHINA.;STATE KEY LABORATORY FOR BIOLOGY OF PLANT DISEASES AND INSECT PESTS, INSTITUTE OF PLANT PROTECTION, CHINESE ACADEMY OF AGRICULTURAL SCIENCES, BEIJING 100193, CHINA.;STATE KEY LABORATORY FOR BIOLOGY OF PLANT DISEASES AND INSECT PESTS, INSTITUTE OF PLANT PROTECTION, CHINESE ACADEMY OF AGRICULTURAL SCIENCES, BEIJING 100193;STATE KEY LABORATORY FOR BIOLOGY OF PLANT DISEASES AND INSECT PESTS, INSTITUTE OF PLANT PROTECTION, CHINESE ACADEMY OF AGRICULTURAL SCIENCES, BEIJING 100193","NA",0,"1879-1026","SCI TOTAL ENVIRON","SCI TOTAL ENVIRON",2023,"2024","910","10.1016/j.scitotenv.2023.168572","168572","","","37992846","37992846","PUBMED","STATE KEY LABORATORY FOR BIOLOGY OF PLANT DISEASES AND INSECT PESTS, INSTITUTE OF PLANT PROTECTION, CHINESE ACADEMY OF AGRICULTURAL SCIENCES, BEIJING 100193, CHINA.;STATE KEY LABORATORY FOR BIOLOGY OF PLANT DISEASES AND INSECT PESTS, INSTITUTE OF PLANT PROTECTION, CHINESE ACADEMY OF AGRICULTURAL SCIENCES, BEIJING 100193, CHINA.;STATE KEY LABORATORY FOR BIOLOGY OF PLANT DISEASES AND INSECT PESTS, INSTITUTE OF PLANT PROTECTION, CHINESE ACADEMY OF AGRICULTURAL SCIENCES, BEIJING 100193, CHINA.;STATE KEY LABORATORY FOR BIOLOGY OF PLANT DISEASES AND INSECT PESTS, INSTITUTE OF PLANT PROTECTION, CHINESE ACADEMY OF AGRICULTURAL SCIENCES, BEIJING 100193, CHINA.;STATE KEY LABORATORY FOR BIOLOGY OF PLANT DISEASES AND INSECT PESTS, INSTITUTE OF PLANT PROTECTION, CHINESE ACADEMY OF AGRICULTURAL SCIENCES, BEIJING 100193, CHINA.;STATE KEY LABORATORY FOR BIOLOGY OF PLANT DISEASES AND INSECT PESTS, INSTITUTE OF PLANT PROTECTION, CHINESE ACADEMY OF AGRICULTURAL SCIENCES, BEIJING 100193, CHINA.;STATE KEY LABORATORY FOR BIOLOGY OF PLANT DISEASES AND INSECT PESTS, INSTITUTE OF PLANT PROTECTION, CHINESE ACADEMY OF AGRICULTURAL SCIENCES, BEIJING 100193;STATE KEY LABORATORY FOR BIOLOGY OF PLANT DISEASES AND INSECT PESTS, INSTITUTE OF PLANT PROTECTION, CHINESE ACADEMY OF AGRICULTURAL SCIENCES, BEIJING 100193","NA","NA"
"664","MA Y;HUANG X;DU H;YANG J;GUO F;WU F","MA, YUANZHE;HUANG, XINTIAN;DU, HUINI;YANG, JING;GUO, FUXING;WU, FUYONG","IMPACTS, CAUSES AND BIOFORTIFICATION STRATEGY OF RICE SELENIUM DEFICIENCY BASED ON PUBLICATION COLLECTION.","THE SCIENCE OF THE TOTAL ENVIRONMENT","NETHERLANDS","ENG","META-ANALYSIS","FIELD SAMPLING;HIDDEN HUNGER;MARKET;PADDY SOIL;RICE;SELENIUM","HUMANS;SELENIUM;BIOFORTIFICATION;ORYZA;MALNUTRITION;SOIL","HUMANS;SELENIUM;BIOFORTIFICATION;ORYZA;MALNUTRITION;SOIL","SELENIUM (SE) DEFICIENCY IN RICE WILL RESULT IN A SE HIDDEN HUNGER THREAT TO THE GENERAL PUBLIC'S HUMAN HEALTH, PARTICULARLY IN AREAS WHERE RICE CONSUMPTION IS HIGH. NEVERTHELESS, THE IMPACT SCOPE AND COPING STRATEGIES HAVE NOT BEEN GIVEN SUFFICIENT FOCUS ON A WORLDWIDE SCALE. IN ORDER TO EVALUATE THE IMPACTS, CAUSES AND BIOFORTIFICATION STRATEGIES OF SE-DEFICIENT RICE, THIS STUDY COLLECTED DATA FROM THE PUBLICATIONS ON THREE THEMES: MARKET SURVEY, FIELD SAMPLING AND CONTROLLED EXPERIMENTS. ACCORDING TO THE MARKET SURVEY, GLOBAL RICE SE CONCENTRATIONS WERE 0.079 MG/KG ON MEAN AND 0.062 MG/KG ON MEDIAN. EAST ASIA HAS A HUMAN SE INTAKE GAP DUE TO THE REGION'S HIGH RICE CONSUMPTION AND THE LOWEST RICE SE CONCENTRATION IN MARKETS GLOBALLY. TOTAL SE CONCENTRATIONS IN EAST ASIAN PADDY SOILS WERE FOUND TO BE ADEQUATE BASED ON THE FIELD SAMPLING. HOWEVER, OVER 70 % OF EAST ASIAN PADDY FIELDS WERE INADEQUATE TO YIELD RICE THAT MET THE GLOBAL MEAN FOR RICE SE CONCENTRATION. THE SE-DEFICIENT RICE WAS PROBABLY CAUSED BY WIDESPREAD LOW SE BIOAVAILABILITY IN EAST ASIAN PADDY FIELDS. THERE WERE TWO IMPORTANT FACTORS INFLUENCING RICE SE ENRICHMENT INCLUDING ROOT SE UPTAKE AND IRON OXIDE IN SOILS. CONCENTRATING ON THESE PROCESSES IS BENEFICIAL TO RICE SE BIOFORTIFICATION. SINCE SE IS ADEQUATE IN THE PADDY SOILS OF EAST ASIA. RATHER OF ADDING SE EXOGENOUSLY, ACTIVATING THE NATIVE SE IN PADDY SOIL IS PROBABLY A MORE APPROPRIATE STRATEGY FOR RICE SE BIOFORTIFICATION IN EAST ASIA. META-ANALYSIS REVEALED WATER MANAGEMENT HAD THE GREATEST IMPACT ON RICE SE BIOFORTIFICATION. THE RISKS AND SOLUTIONS FOR RICE SE DEFICIENCY WERE DISCUSSED IN OUR FARMLAND-TO-TABLE SURVEY, WHICH WILL BE A VALUABLE INFORMATION IN ADDRESSING THE GLOBAL CHALLENGE OF SE HIDDEN HUNGER. THIS STUDY ALSO PROVIDED NEW PERSPECTIVES AND THEIR JUSTIFICATIONS, CRITICALLY ANALYZING BOTH PRESENT AND FUTURE STRATEGIES TO ADDRESS SE HIDDEN HUNGER.","COLLEGE OF NATURAL RESOURCES AND ENVIRONMENT, NORTHWEST A&F UNIVERSITY, YANGLING, SHAANXI 712100, CHINA.;COLLEGE OF NATURAL RESOURCES AND ENVIRONMENT, NORTHWEST A&F UNIVERSITY, YANGLING, SHAANXI 712100, CHINA.;COLLEGE OF NATURAL RESOURCES AND ENVIRONMENT, NORTHWEST A&F UNIVERSITY, YANGLING, SHAANXI 712100, CHINA.;COLLEGE OF NATURAL RESOURCES AND ENVIRONMENT, NORTHWEST A&F UNIVERSITY, YANGLING, SHAANXI 712100, CHINA.;COLLEGE OF NATURAL RESOURCES AND ENVIRONMENT, NORTHWEST A&F UNIVERSITY, YANGLING, SHAANXI 712100, CHINA.;COLLEGE OF NATURAL RESOURCES AND ENVIRONMENT, NORTHWEST A&F UNIVERSITY, YANGLING, SHAANXI 712100, CHINA; KEY LABORATORY OF PLANT NUTRITION AND THE AGRI-ENVIRONMENT IN NORTHWEST CHINA, MINISTRY OF AGRICULTURE, YANGLING 712100, SHAANXI","NA",0,"1879-1026","SCI TOTAL ENVIRON","SCI TOTAL ENVIRON",2023,"2024","912","10.1016/j.scitotenv.2023.169619","169619","","","38157912","38157912","PUBMED","COLLEGE OF NATURAL RESOURCES AND ENVIRONMENT, NORTHWEST A&F UNIVERSITY, YANGLING, SHAANXI 712100, CHINA.;COLLEGE OF NATURAL RESOURCES AND ENVIRONMENT, NORTHWEST A&F UNIVERSITY, YANGLING, SHAANXI 712100, CHINA.;COLLEGE OF NATURAL RESOURCES AND ENVIRONMENT, NORTHWEST A&F UNIVERSITY, YANGLING, SHAANXI 712100, CHINA.;COLLEGE OF NATURAL RESOURCES AND ENVIRONMENT, NORTHWEST A&F UNIVERSITY, YANGLING, SHAANXI 712100, CHINA.;COLLEGE OF NATURAL RESOURCES AND ENVIRONMENT, NORTHWEST A&F UNIVERSITY, YANGLING, SHAANXI 712100, CHINA.;COLLEGE OF NATURAL RESOURCES AND ENVIRONMENT, NORTHWEST A&F UNIVERSITY, YANGLING, SHAANXI 712100, CHINA; KEY LABORATORY OF PLANT NUTRITION AND THE AGRI-ENVIRONMENT IN NORTHWEST CHINA, MINISTRY OF AGRICULTURE, YANGLING 712100, SHAANXI","NA","NA"
"4161","SALES LP;HOUNKPE BW;PEREZ MO;CAPARBO VF;DOMICIANO DS;BORBA EF;SCHETT G;FIGUEIREDO CP;PEREIRA RMR","SALES, LUCAS PEIXOTO;HOUNKPE, BIDOSSESSI WILFRIED;PEREZ, MARIANA ORTEGA;CAPARBO, VALÉRIA FALCO;DOMICIANO, DIOGO SOUZA;BORBA, EDUARDO FERREIRA;SCHETT, GEORG;FIGUEIREDO, CAMILLE PINTO;PEREIRA, ROSA MARIA RODRIGUES","TRANSCRIPTOMIC CHARACTERIZATION OF CLASSICAL MONOCYTES HIGHLIGHTS THE INVOLVEMENT OF IMMUNO-INFLAMMATION IN BONE EROSION IN RHEUMATOID ARTHRITIS.","FRONTIERS IN IMMUNOLOGY","SWITZERLAND","ENG","JOURNAL ARTICLE","BONE EROSIONS;BONE FORMATION;CLASSICAL MONOCYTES;INFLAMMATION;RHEUMATOID ARTHRITIS","HUMANS;FEMALE;MONOCYTES;TRANSCRIPTOME;ARTHRITIS, RHEUMATOID;INFLAMMATION;GENE EXPRESSION PROFILING","HUMANS;FEMALE;MONOCYTES;TRANSCRIPTOME;ARTHRITIS, RHEUMATOID;INFLAMMATION;GENE EXPRESSION PROFILING","EVIDENCE-BASED DATA SUGGEST THAT UNDER INFLAMMATORY CONDITIONS, CLASSICAL MONOCYTES ARE THE MAIN SOURCE OF OSTEOCLASTS AND MIGHT BE INVOLVED IN BONE EROSION PATHOPHYSIOLOGY. HERE, WE ANALYZE THE TRANSCRIPTOMIC PROFILE OF CLASSICAL MONOCYTES IN EROSIVE AND NON-EROSIVE RHEUMATOID ARTHRITIS PATIENTS IN ORDER TO BETTER UNDERSTAND THEIR CONTRIBUTION TO BONE EROSION. THIRTY-NINE PREMENOPAUSAL RA PATIENTS WERE CONSECUTIVELY ENROLLED AND DIVIDED INTO TWO GROUPS BASED ON THE PRESENCE OF BONE EROSIONS ON HAND JOINTS. CLASSICAL MONOCYTES WERE ISOLATED FROM PERIPHERAL BLOOD THROUGH NEGATIVE SELECTION, AND RNA-SEQ WAS PERFORMED USING A POLY-A ENRICHMENT KIT AND ILLUMINA® PLATFORM. CLASSICAL MONOCYTES TRANSCRIPTOME FROM HEALTHY AGE-MATCHED WOMEN WERE ALSO INCLUDED TO IDENTIFY DIFFERENTIALLY EXPRESSED GENES (DEGS). THEREFORE, GENE SETS ANALYSIS WAS PERFORMED TO IDENTIFY THE ENRICHED BIOLOGICAL PATHWAYS. RNA-SEQ ANALYSIS RESULTED IN THE IDENTIFICATION OF 1,140 DEGS OF WHICH 89 WERE UP-REGULATED AND 1,051 DOWN-REGULATED IN RA PATIENTS WITH BONE EROSION COMPARED TO THOSE WITHOUT BONE EROSIONS. AMONG UP-REGULATED GENES, THERE WAS A HIGHLIGHTED EXPRESSION OF   AND   RELATED TO THE PRODUCTION OF PRO-INFLAMMATORY CYTOKINES, INNATE AND ADAPTIVE IMMUNE RESPONSE. GENES RELATED TO COLLAGEN METABOLISM ( ) AND BONE FORMATION PROCESS ( ) WERE DOWN-REGULATED IN RA PATIENTS WITH EROSIONS. ENRICHED PATHWAYS IN PATIENTS WITH EROSIONS WERE ASSOCIATED WITH GREATER ACTIVATION OF IMMUNE ACTIVATION, AND INFLAMMATION. INTERESTINGLY, PATHWAYS ASSOCIATED WITH OSTEOBLAST DIFFERENTIATION AND REGULATION OF WNT SIGNALING WERE LESS ACTIVATED IN RA PATIENTS WITH EROSIONS. THESE FINDINGS SUGGEST THAT ALTERATIONS IN EXPRESSION OF MONOCYTE GENES RELATED TO THE INFLAMMATORY PROCESS AND IMPAIRMENT OF BONE FORMATION MIGHT HAVE AN IMPORTANT ROLE IN THE PATHOPHYSIOLOGY OF BONE EROSIONS IN RA PATIENTS.","RHEUMATOLOGY DIVISION, BONE METABOLISM LABORATORY, FACULDADE DE MEDICINA, UNIVERSIDADE DE SÃO PAULO, SÃO PAULO, BRAZIL.;RHEUMATOLOGY DIVISION, BONE METABOLISM LABORATORY, FACULDADE DE MEDICINA, UNIVERSIDADE DE SÃO PAULO, SÃO PAULO, BRAZIL.;RHEUMATOLOGY DIVISION, BONE METABOLISM LABORATORY, FACULDADE DE MEDICINA, UNIVERSIDADE DE SÃO PAULO, SÃO PAULO, BRAZIL.;RHEUMATOLOGY DIVISION, BONE METABOLISM LABORATORY, FACULDADE DE MEDICINA, UNIVERSIDADE DE SÃO PAULO, SÃO PAULO, BRAZIL.;RHEUMATOLOGY DIVISION, BONE METABOLISM LABORATORY, FACULDADE DE MEDICINA, UNIVERSIDADE DE SÃO PAULO, SÃO PAULO, BRAZIL.;RHEUMATOLOGY DIVISION, BONE METABOLISM LABORATORY, FACULDADE DE MEDICINA, UNIVERSIDADE DE SÃO PAULO, SÃO PAULO, BRAZIL.;DEPARTMENT OF INTERNAL MEDICINE 3-RHEUMATOLOGY AND IMMUNOLOGY, FRIEDRICH ALEXANDER UNIVERSITÄT ERLANGEN-NÜRNBERG AND UNIVERSITÄTSKLINIKUM ERLANGEN, ERLANGEN, GERMANY.;RHEUMATOLOGY DIVISION, BONE METABOLISM LABORATORY, FACULDADE DE MEDICINA, UNIVERSIDADE DE SÃO PAULO, SÃO PAULO, BRAZIL.;RHEUMATOLOGY DIVISION, BONE METABOLISM LABORATORY, FACULDADE DE MEDICINA, UNIVERSIDADE DE SÃO PAULO, SÃO PAULO, BRAZIL.","NA",0,"1664-3224","FRONT IMMUNOL","FRONT IMMUNOL",2023,"2023","14","10.3389/fimmu.2023.1251034","1251034","","","37868981","37868981","PUBMED","RHEUMATOLOGY DIVISION, BONE METABOLISM LABORATORY, FACULDADE DE MEDICINA, UNIVERSIDADE DE SÃO PAULO, SÃO PAULO, BRAZIL.;RHEUMATOLOGY DIVISION, BONE METABOLISM LABORATORY, FACULDADE DE MEDICINA, UNIVERSIDADE DE SÃO PAULO, SÃO PAULO, BRAZIL.;RHEUMATOLOGY DIVISION, BONE METABOLISM LABORATORY, FACULDADE DE MEDICINA, UNIVERSIDADE DE SÃO PAULO, SÃO PAULO, BRAZIL.;RHEUMATOLOGY DIVISION, BONE METABOLISM LABORATORY, FACULDADE DE MEDICINA, UNIVERSIDADE DE SÃO PAULO, SÃO PAULO, BRAZIL.;RHEUMATOLOGY DIVISION, BONE METABOLISM LABORATORY, FACULDADE DE MEDICINA, UNIVERSIDADE DE SÃO PAULO, SÃO PAULO, BRAZIL.;RHEUMATOLOGY DIVISION, BONE METABOLISM LABORATORY, FACULDADE DE MEDICINA, UNIVERSIDADE DE SÃO PAULO, SÃO PAULO, BRAZIL.;DEPARTMENT OF INTERNAL MEDICINE 3-RHEUMATOLOGY AND IMMUNOLOGY, FRIEDRICH ALEXANDER UNIVERSITÄT ERLANGEN-NÜRNBERG AND UNIVERSITÄTSKLINIKUM ERLANGEN, ERLANGEN, GERMANY.;RHEUMATOLOGY DIVISION, BONE METABOLISM LABORATORY, FACULDADE DE MEDICINA, UNIVERSIDADE DE SÃO PAULO, SÃO PAULO, BRAZIL.;RHEUMATOLOGY DIVISION, BONE METABOLISM LABORATORY, FACULDADE DE MEDICINA, UNIVERSIDADE DE SÃO PAULO, SÃO PAULO, BRAZIL.","NA","NA"
