"","AU","AF","TI","SO","SO_CO","LA","DT","DE","ID","MESH","AB","C1","CR","TC","SN","J9","JI","PY","PY_IS","VL","DI","PG","GRANT_ID","GRANT_ORG","UT","PMID","DB","AU_UN","AU_CO","AU1_CO"
"893","LIU T;WU H;WEI J","LIU, TINGTING;WU, HAOJIE;WEI, JIANSHE","THE CONSTRUCTION AND VALIDATION OF A NOVEL FERROPTOSIS-RELATED GENE SIGNATURE IN PARKINSON'S DISEASE.","INTERNATIONAL JOURNAL OF MOLECULAR SCIENCES","SWITZERLAND","ENG","JOURNAL ARTICLE","PARKINSON’S DISEASE;FERROPTOSIS;MITOCHONDRIA;SUBSTANTIA NIGRA","ANIMALS;MICE;PARKINSON DISEASE;FERROPTOSIS;MICRORNAS;MITOCHONDRIAL DISEASES","ANIMALS;MICE;PARKINSON DISEASE;FERROPTOSIS;MICRORNAS;MITOCHONDRIAL DISEASES","AS A NEWLY DISCOVERED REGULATED CELL DEATH MODE, FERROPTOSIS IS ASSOCIATED WITH THE DEVELOPMENT OF PARKINSON'S DISEASE (PD) AND HAS ATTRACTED MUCH ATTENTION. NONETHELESS, THE RELATIONSHIP BETWEEN FERROPTOSIS AND PD PATHOGENESIS REMAINS UNCLEAR. THE GSE8397 DATASET INCLUDES GPL96 AND GPL97 PLATFORMS. THE DIFFERENTIAL GENES WERE ANALYZED BY IMMUNE INFILTRATION AND GENE SET ENRICHMENT ANALYSIS (GSEA) (  < 0.05), AND DIFFERENTIAL MULTIPLE |LOGFC| > 1 AND WEIGHTED GENE COEXPRESSION NETWORK ANALYSIS (WGCNA) WERE USED TO SCREEN DIFFERENTIAL EXPRESSION GENES (DEGS). THE INTERSECTION WITH 368 FERROPTOSIS-RELATED GENES (FRGS) WAS CONDUCTED FOR GENE ONTOLOGY/KYOTO ENCYCLOPEDIA OF GENE AND GENOME (GO/KEGG) ENRICHMENT ANALYSIS, GENE EXPRESSION ANALYSIS, CORRELATION ANALYSIS, SINGLE-CELL SEQUENCING ANALYSIS, AND PROGNOSIS ANALYSIS (AREA UNDER THE CURVE, AUC) AND TO PREDICT RELEVANT MIRNAS AND CONSTRUCT NETWORK DIAGRAMS USING CYTOSCAPE. THE INTERSECTION GENES OF DIFFERENTIALLY EXPRESSED FERROPTOSIS-RELATED GENES (DEFRGS) AND MITOCHONDRIAL DYSFUNCTION GENES WERE VALIDATED IN THE SUBSTANTIA NIGRA OF MPTP-INDUCED PD MICE MODELS BY WESTERN BLOTTING AND IMMUNOHISTOCHEMISTRY, AND THE PROTEIN-BINDING POCKET WAS PREDICTED USING THE DOGSITESCORER DATABASE. ACCORDING TO THE RESULTS, THE ESTIMATED SCORES WERE POSITIVELY CORRELATED WITH THE STROMAL SCORES OR IMMUNE SCORES IN THE GPL96 AND GPL97 PLATFORMS. IN THE GPL96 PLATFORM, THE GSEA SHOWED THAT DIFFERENTIAL GENES WERE MAINLY INVOLVED IN THE GNRH SIGNALING PATHWAY, B CELL RECEPTOR SIGNALING PATHWAY, INOSITOL PHOSPHATE METABOLISM, ETC. IN THE GPL97 PLATFORM, THE GSEA SHOWED THAT DIFFERENTIAL GENES WERE MAINLY INVOLVED IN THE UBIQUITIN-MEDIATED PROTEOLYSIS, AXON GUIDANCE, WNT SIGNALING PATHWAY, MAPK SIGNALING PATHWAY, ETC. WE OBTAINED 26 DEFRGS, INCLUDING 12 UP-REGULATED GENES AND 14 DOWN-REGULATED GENES, WITH GOOD CORRELATION. THE AREA UNDER THE PROGNOSTIC ANALYSIS CURVE (AUC > 0.700) SHOWED A GOOD PROGNOSTIC ABILITY. WE FOUND THAT THEY WERE ENRICHED IN DIFFERENT NEURONAL CELLS, OLIGODENDROCYTES, ASTROCYTES, OLIGODENDROCYTE PRECURSOR CELLS, AND MICROGLIAL CELLS, AND THEIR EXPRESSION SCORES WERE POSITIVELY CORRELATED, AND SELECTED GENES WITH AN AUC CURVE ≥0.9 WERE USED TO PREDICT MIRNA, INCLUDING MIR-214/761/3619-5P, MIR-203, MIR-204/204B/211, MIR-128/128AB, MIR-199AB-5P, ETC. FOR THE DIFFERENTIALLY EXPRESSED FERROPTOSIS-MITOCHONDRIAL DYSFUNCTION-RELATED GENES (DEF-MDRGS) ( ,  ,  , AND  ), IN THE SUBSTANTIA NIGRA OF MICE, COMPARED WITH THE SALINE GROUP, THE EXPRESSION OF AR AND ISCU WAS DECREASED (  < 0.05), AND THE EXPRESSION OF Α-SYN AND PDK4 WAS INCREASED (  < 0.05) IN THE MPTP GROUP. THERAPEUTIC DRUGS THAT TARGET SNCA INCLUDE ABBV-0805, PRASINEZUMAB, CINPANEMAB, AND GARDENIN A. THE RESULTS OF THIS STUDY SUGGEST THAT CELLULAR DEF-MDRGS MIGHT PLAY AN IMPORTANT ROLE IN PD.  ,  ,  , AND   HAVE THE POTENTIAL TO BE SPECIFIC BIOMARKERS FOR THE EARLY DIAGNOSIS OF PD.","INSTITUTE FOR BRAIN SCIENCES RESEARCH, SCHOOL OF LIFE SCIENCES, HENAN UNIVERSITY, KAIFENG 475004, CHINA.;INSTITUTE FOR BRAIN SCIENCES RESEARCH, SCHOOL OF LIFE SCIENCES, HENAN UNIVERSITY, KAIFENG 475004, CHINA.;INSTITUTE FOR BRAIN SCIENCES RESEARCH, SCHOOL OF LIFE SCIENCES, HENAN UNIVERSITY, KAIFENG 475004, CHINA.","NA",0,"1422-0067","INT J MOL SCI","INT J MOL SCI",2023,"2023","24","10.3390/ijms242417203",NA,"81271410;32161143021;182300410313;SYLYC2023092","NATIONAL NATURAL SCIENCE FOUNDATION OF CHINA;NATIONAL NATURAL SCIENCE FOUNDATION OF CHINA;HENAN PROVINCE NATURAL SCIENCE FOUNDATION OF CHINA;HENAN UNIVERSITY GRADUATE «TALENT PROGRAM» OF HENAN PROVINCE","38139032","38139032","PUBMED","INSTITUTE FOR BRAIN SCIENCES RESEARCH, SCHOOL OF LIFE SCIENCES, HENAN UNIVERSITY, KAIFENG 475004, CHINA.;INSTITUTE FOR BRAIN SCIENCES RESEARCH, SCHOOL OF LIFE SCIENCES, HENAN UNIVERSITY, KAIFENG 475004, CHINA.;INSTITUTE FOR BRAIN SCIENCES RESEARCH, SCHOOL OF LIFE SCIENCES, HENAN UNIVERSITY, KAIFENG 475004, CHINA.","NA","NA"
"1572","DE SOUSA SMC;SHEN A;YATES CJ;CLIFTON-BLIGH R;SANTORENEOS S;KING J;TOUBIA J;TRIVELLIN G;LANIA AG;STRATAKIS CA;TORPY DJ;SCOTT HS","DE SOUSA, SUNITA M C;SHEN, ANGELINE;YATES, CHRISTOPHER J;CLIFTON-BLIGH, RODERICK;SANTORENEOS, STEPHEN;KING, JAMES;TOUBIA, JOHN;TRIVELLIN, GIAMPAOLO;LANIA, ANDREA G;STRATAKIS, CONSTANTINE A;TORPY, DAVID J;SCOTT, HAMISH S",NA,"FRONTIERS IN ENDOCRINOLOGY","SWITZERLAND","ENG","JOURNAL ARTICLE","CUSHING’S DISEASE;PEPTIDYLGLYCINE Α-AMIDATING MONOOXYGENASE;PITUITARY ADENOMAS;PROLACTINOMA;THYROTROPHINOMA;WHOLE EXOME SEQUENCING","HUMANS;ACTH-SECRETING PITUITARY ADENOMA;ADENOMA;PITUITARY ACTH HYPERSECRETION;PITUITARY NEOPLASMS;PROLACTINOMA","HUMANS;ACTH-SECRETING PITUITARY ADENOMA;ADENOMA;PITUITARY ACTH HYPERSECRETION;PITUITARY NEOPLASMS;PROLACTINOMA","GERMLINE LOSS-OF-FUNCTION VARIANTS IN  , ENCODING PEPTIDYLGLYCINE Α-AMIDATING MONOOXYGENASE (PAM), WERE RECENTLY DISCOVERED TO BE ENRICHED IN CONDITIONS OF PATHOLOGICAL PITUITARY HYPERSECRETION, SPECIFICALLY: SOMATOTROPHINOMA, CORTICOTROPHINOMA, AND PROLACTINOMA. PAM IS THE SOLE ENZYME RESPONSIBLE FOR C-TERMINAL AMIDATION OF PEPTIDES, AND PLAYS A ROLE IN THE BIOSYNTHESIS AND REGULATION OF MULTIPLE HORMONES, INCLUDING PROOPIOMELANOCORTIN (POMC). WE PERFORMED EXOME SEQUENCING OF GERMLINE AND TUMOUR DNA FROM 29 INDIVIDUALS WITH FUNCTIONING PITUITARY ADENOMAS (12 PROLACTINOMAS, 10 THYROTROPHINOMAS, 7 CYCLICAL CUSHING'S DISEASE). AN UNFILTERED ANALYSIS WAS UNDERTAKEN OF ALL   VARIANTS WITH POPULATION PREVALENCE <5%. WE IDENTIFIED FIVE CODING, NON-SYNONYMOUS   VARIANTS OF INTEREST AMONGST SEVEN INDIVIDUALS (SIX GERMLINE, ONE SOMATIC). THE FIVE VARIANTS COMPRISED FOUR MISSENSE VARIANTS AND ONE TRUNCATING VARIANT, ALL HETEROZYGOUS. EACH VARIANT HAD SOME EVIDENCE OF PATHOGENICITY BASED ON POPULATION PREVALENCE, CONSERVATION SCORES,   PREDICTIONS AND/OR PRIOR FUNCTIONAL STUDIES. THE YIELD OF PREDICTED DELETERIOUS   VARIANTS WAS THUS 7/29 (24%). THE VARIANTS PREDOMINATED IN INDIVIDUALS WITH THYROTROPHINOMAS (4/10, 40%) AND CYCLICAL CUSHING'S DISEASE (2/7, 29%), COMPARED TO PROLACTINOMAS (1/12, 8%). THIS IS THE SECOND STUDY TO DEMONSTRATE A HIGH YIELD OF SUSPECTED LOSS-OF-FUNCTION, PREDOMINANTLY GERMLINE,   VARIANTS IN INDIVIDUALS WITH PATHOLOGICAL PITUITARY HYPERSECRETION. WE HAVE EXTENDED THE ASSOCIATION WITH CORTICOTROPHINOMA TO INCLUDE THE SPECIFIC CLINICAL ENTITY OF CYCLICAL CUSHING'S DISEASE AND DEMONSTRATED A NOVEL ASSOCIATION BETWEEN   VARIANTS AND THYROTROPHINOMA.   VARIANTS MIGHT ACT AS RISK ALLELES FOR PITUITARY ADENOMA FORMATION, WITH A POSSIBLE GENOTYPE-PHENOTYPE RELATIONSHIP BETWEEN TRUNCATING VARIANTS AND ALTERED TEMPORAL SECRETION OF CORTISOL.","ENDOCRINE & METABOLIC UNIT, ROYAL ADELAIDE HOSPITAL, ADELAIDE, SA, AUSTRALIA.;SOUTH AUSTRALIAN ADULT GENETICS UNIT, ROYAL ADELAIDE HOSPITAL, ADELAIDE, SA, AUSTRALIA.;ADELAIDE MEDICAL SCHOOL, UNIVERSITY OF ADELAIDE, ADELAIDE, SA, AUSTRALIA.;DEPARTMENT OF DIABETES AND ENDOCRINOLOGY, ROYAL MELBOURNE HOSPITAL, MELBOURNE, VIC, AUSTRALIA.;DEPARTMENT OF MEDICINE, UNIVERSITY OF MELBOURNE, MELBOURNE, VIC, AUSTRALIA.;DEPARTMENT OF DIABETES AND ENDOCRINOLOGY, ROYAL MELBOURNE HOSPITAL, MELBOURNE, VIC, AUSTRALIA.;DEPARTMENT OF MEDICINE, UNIVERSITY OF MELBOURNE, MELBOURNE, VIC, AUSTRALIA.;CANCER GENETICS LABORATORY, KOLLING INSTITUTE, ROYAL NORTH SHORE HOSPITAL, SYDNEY, NSW, AUSTRALIA.;SYDNEY MEDICAL SCHOOL, THE UNIVERSITY OF SYDNEY, SYDNEY, NSW, AUSTRALIA.;DEPARTMENT OF ENDOCRINOLOGY, ROYAL NORTH SHORE HOSPITAL, SYDNEY, NSW, AUSTRALIA.;DEPARTMENT OF NEUROSURGERY, ROYAL ADELAIDE HOSPITAL, ADELAIDE, SA, AUSTRALIA.;DEPARTMENT OF SURGERY, UNIVERSITY OF MELBOURNE, MELBOURNE, VIC, AUSTRALIA.;ACRF CANCER GENOMICS FACILITY, CENTRE FOR CANCER BIOLOGY, UNIVERSITY OF SOUTH AUSTRALIA AND SA PATHOLOGY, ADELAIDE, SA, AUSTRALIA.;DEPARTMENT OF BIOMEDICAL SCIENCES, HUMANITAS UNIVERSITY, MILAN, ITALY.;IRCCS HUMANITAS RESEARCH HOSPITAL, MILAN, ITALY.;DEPARTMENT OF BIOMEDICAL SCIENCES, HUMANITAS UNIVERSITY, MILAN, ITALY.;IRCCS HUMANITAS RESEARCH HOSPITAL, MILAN, ITALY.;SECTION ON ENDOCRINOLOGY AND GENETICS, EUNICE KENNEDY SHRIVER NATIONAL INSTITUTE OF CHILD HEALTH AND HUMAN DEVELOPMENT (NICHD), NATIONAL INSTITUTES OF HEALTH (NIH), BETHESDA, MD, UNITED STATES.;HUMAN GENETICS AND PRECISION MEDICINE, INSTITUTE OF MOLECULAR BIOLOGY AND BIOTECHNOLOGY (IMBB), FOUNDATION FOR RESEARCH AND TECHNOLOGY HELLAS, HERAKLION, GREECE.;RESEARCH INSTITUTE, ELPEN, ATHENS, GREECE.;ENDOCRINE & METABOLIC UNIT, ROYAL ADELAIDE HOSPITAL, ADELAIDE, SA, AUSTRALIA.;ADELAIDE MEDICAL SCHOOL, UNIVERSITY OF ADELAIDE, ADELAIDE, SA, AUSTRALIA.;ADELAIDE MEDICAL SCHOOL, UNIVERSITY OF ADELAIDE, ADELAIDE, SA, AUSTRALIA.;DEPARTMENT OF GENETICS AND MOLECULAR PATHOLOGY, CENTRE FOR CANCER BIOLOGY, AN SA PATHOLOGY AND UNIVERSITY OF SOUTH AUSTRALIA ALLIANCE, ADELAIDE, SA, AUSTRALIA.","NA",0,"1664-2392","FRONT ENDOCRINOL (LAUSANNE)","FRONT ENDOCRINOL (LAUSANNE)",2023,"2023","14","10.3389/fendo.2023.1305606","1305606","","","38075079","38075079","PUBMED","ENDOCRINE & METABOLIC UNIT, ROYAL ADELAIDE HOSPITAL, ADELAIDE, SA, AUSTRALIA.;SOUTH AUSTRALIAN ADULT GENETICS UNIT, ROYAL ADELAIDE HOSPITAL, ADELAIDE, SA, AUSTRALIA.;ADELAIDE MEDICAL SCHOOL, UNIVERSITY OF ADELAIDE, ADELAIDE, SA, AUSTRALIA.;DEPARTMENT OF DIABETES AND ENDOCRINOLOGY, ROYAL MELBOURNE HOSPITAL, MELBOURNE, VIC, AUSTRALIA.;DEPARTMENT OF MEDICINE, UNIVERSITY OF MELBOURNE, MELBOURNE, VIC, AUSTRALIA.;DEPARTMENT OF DIABETES AND ENDOCRINOLOGY, ROYAL MELBOURNE HOSPITAL, MELBOURNE, VIC, AUSTRALIA.;DEPARTMENT OF MEDICINE, UNIVERSITY OF MELBOURNE, MELBOURNE, VIC, AUSTRALIA.;CANCER GENETICS LABORATORY, KOLLING INSTITUTE, ROYAL NORTH SHORE HOSPITAL, SYDNEY, NSW, AUSTRALIA.;SYDNEY MEDICAL SCHOOL, THE UNIVERSITY OF SYDNEY, SYDNEY, NSW, AUSTRALIA.;DEPARTMENT OF ENDOCRINOLOGY, ROYAL NORTH SHORE HOSPITAL, SYDNEY, NSW, AUSTRALIA.;DEPARTMENT OF NEUROSURGERY, ROYAL ADELAIDE HOSPITAL, ADELAIDE, SA, AUSTRALIA.;DEPARTMENT OF SURGERY, UNIVERSITY OF MELBOURNE, MELBOURNE, VIC, AUSTRALIA.;ACRF CANCER GENOMICS FACILITY, CENTRE FOR CANCER BIOLOGY, UNIVERSITY OF SOUTH AUSTRALIA AND SA PATHOLOGY, ADELAIDE, SA, AUSTRALIA.;DEPARTMENT OF BIOMEDICAL SCIENCES, HUMANITAS UNIVERSITY, MILAN, ITALY.;IRCCS HUMANITAS RESEARCH HOSPITAL, MILAN, ITALY.;DEPARTMENT OF BIOMEDICAL SCIENCES, HUMANITAS UNIVERSITY, MILAN, ITALY.;IRCCS HUMANITAS RESEARCH HOSPITAL, MILAN, ITALY.;SECTION ON ENDOCRINOLOGY AND GENETICS, EUNICE KENNEDY SHRIVER NATIONAL INSTITUTE OF CHILD HEALTH AND HUMAN DEVELOPMENT (NICHD), NATIONAL INSTITUTES OF HEALTH (NIH), BETHESDA, MD, UNITED STATES.;HUMAN GENETICS AND PRECISION MEDICINE, INSTITUTE OF MOLECULAR BIOLOGY AND BIOTECHNOLOGY (IMBB), FOUNDATION FOR RESEARCH AND TECHNOLOGY HELLAS, HERAKLION, GREECE.;RESEARCH INSTITUTE, ELPEN, ATHENS, GREECE.;ENDOCRINE & METABOLIC UNIT, ROYAL ADELAIDE HOSPITAL, ADELAIDE, SA, AUSTRALIA.;ADELAIDE MEDICAL SCHOOL, UNIVERSITY OF ADELAIDE, ADELAIDE, SA, AUSTRALIA.;ADELAIDE MEDICAL SCHOOL, UNIVERSITY OF ADELAIDE, ADELAIDE, SA, AUSTRALIA.;DEPARTMENT OF GENETICS AND MOLECULAR PATHOLOGY, CENTRE FOR CANCER BIOLOGY, AN SA PATHOLOGY AND UNIVERSITY OF SOUTH AUSTRALIA ALLIANCE, ADELAIDE, SA, AUSTRALIA.","NA","NA"
"7868","ZHANG J;GUAN H;WANG T;DU S;XU J;LIU X","ZHANG, JIAWEN;GUAN, HAORAN;WANG, TONG;DU, SHAOTING;XU, JIANMING;LIU, XINGMEI","ENRICHMENT OF CADMIUM AND SELENIUM IN SOIL-CROP SYSTEM AND ASSOCIATED PROBABILISTIC HEALTH RISKS IN BLACK SHALE AREAS.","ENVIRONMENTAL SCIENCE AND POLLUTION RESEARCH INTERNATIONAL","GERMANY","ENG","JOURNAL ARTICLE","ACCUMULATION CHARACTERISTICS;BLACK SHALES;HEALTH RISK ASSESSMENT;HIGH GEOLOGICAL BACKGROUND;LOW-CD AND RICH-SE VARIETIES;PROBABILISTIC RISK;SOIL-CROP SYSTEM","CHILD;HUMANS;CADMIUM;SELENIUM;SOIL;SOIL POLLUTANTS;METALS, HEAVY;RISK ASSESSMENT;CHINA;ENVIRONMENTAL MONITORING","CHILD;HUMANS;CADMIUM;SELENIUM;SOIL;SOIL POLLUTANTS;METALS, HEAVY;RISK ASSESSMENT;CHINA;ENVIRONMENTAL MONITORING","SELENIUM (SE) IS THE ESSENTIAL COMPONENT OF SELENOENZYMES AND CONTRIBUTES TO ANTIOXIDANT DEFENSES. THE CAPABILITY OF SE TO ANTAGONIZE THE TOXICITY OF HEAVY METALS MAKES IT AN ESSENTIAL TRACE ELEMENT FOR HUMAN AND PLANT HEALTH. SOILS DERIVED FROM BLACK SHALES ARE NATURALLY ENRICHED WITH SE; HOWEVER, THESE SOILS OFTEN CONTAIN HIGH GEOLOGICAL CADMIUM (CD), DUE TO THE WEATHERING OF BLACK SHALES RICH IN CD AND SE. CADMIUM, AS A KNOWN GROUP I CARCINOGEN, COULD INDUCE DAMAGE TO VARIOUS ORGANS. THIS THEREFORE POSES A MAJOR CHALLENGE FOR SAFE CULTIVATION OF SE-RICH LAND RESOURCES. IN THIS STUDY, A TOTAL OF 247 PAIRED SOIL-CROP SAMPLES WERE COLLECTED FROM A TYPICAL FARMLAND DERIVED FROM BLACK SHALES. THE CONCENTRATIONS OF CD AND SE IN THE SAMPLES WERE ANALYZED BY INDUCTIVELY COUPLED PLASMA MASS SPECTROSCOPY AND ATOMIC FLUORESCENCE SPECTROMETRY. MONTE CARLO SIMULATION WAS APPLIED TO EVALUATE POTENTIAL HEALTH RISKS ASSOCIATED WITH CD EXPOSURE. CADMIUM WAS THE CRITICAL POLLUTANT IN THE STUDY AREA, WITH THE AVERAGE VALUE OF 1.53 MG/KG. MOREOVER, BOTH CHILDREN AND ADULTS LIVING IN THE AREA HAD A SIGNIFICANT NON-CARCINOGENIC HEALTH RISK. ADDITIONAL HEALTH RISK ASSESSMENTS REVEALED THAT DIET WAS THE MAIN CONTRIBUTOR FOR BOTH CHILDREN AND ADULTS AMONG THE FOUR PATHWAYS (DIET > SOIL INGESTION > SOIL DERMAL ADSORPTION > SOIL INHALATION). FURTHERMORE, OUR RESULTS REVEALED THAT LEGUMINOUS VEGETABLES AND MAIZE WERE IDEAL FOR THIS SITE DUE TO THEIR HIGH SE AND LOW CD ACCUMULATION ABILITIES. THESE FINDINGS PROVIDE SUPPORT FOR ADJUSTING PLANTING STRUCTURE BY VARIETY SCREENING TO MITIGATE THE HEALTH RISK INDUCED BY CD.","COLLEGE OF ENVIRONMENTAL & NATURAL RESOURCES, ZHEJIANG UNIVERSITY, HANGZHOU, 310058, CHINA.;COLLEGE OF ENVIRONMENTAL & NATURAL RESOURCES, ZHEJIANG UNIVERSITY, HANGZHOU, 310058, CHINA.;COLLEGE OF ENVIRONMENTAL & NATURAL RESOURCES, ZHEJIANG UNIVERSITY, HANGZHOU, 310058, CHINA.;KEY LABORATORY OF POLLUTION EXPOSURE AND HEALTH INTERVENTION OF ZHEJIANG PROVINCE, INTERDISCIPLINARY RESEARCH ACADEMY (IRA), ZHEJIANG SHUREN UNIVERSITY, HANGZHOU, 310015, CHINA.;COLLEGE OF ENVIRONMENTAL & NATURAL RESOURCES, ZHEJIANG UNIVERSITY, HANGZHOU, 310058, CHINA.;COLLEGE OF ENVIRONMENTAL & NATURAL RESOURCES, ZHEJIANG UNIVERSITY, HANGZHOU, 310058","NA",0,"1614-7499","ENVIRON SCI POLLUT RES INT","ENVIRON SCI POLLUT RES INT",2023,"2023","30","10.1007/s11356-023-29173-6","95988-96000","","","37561298","37561298","PUBMED","COLLEGE OF ENVIRONMENTAL & NATURAL RESOURCES, ZHEJIANG UNIVERSITY, HANGZHOU, 310058, CHINA.;COLLEGE OF ENVIRONMENTAL & NATURAL RESOURCES, ZHEJIANG UNIVERSITY, HANGZHOU, 310058, CHINA.;COLLEGE OF ENVIRONMENTAL & NATURAL RESOURCES, ZHEJIANG UNIVERSITY, HANGZHOU, 310058, CHINA.;KEY LABORATORY OF POLLUTION EXPOSURE AND HEALTH INTERVENTION OF ZHEJIANG PROVINCE, INTERDISCIPLINARY RESEARCH ACADEMY (IRA), ZHEJIANG SHUREN UNIVERSITY, HANGZHOU, 310015, CHINA.;COLLEGE OF ENVIRONMENTAL & NATURAL RESOURCES, ZHEJIANG UNIVERSITY, HANGZHOU, 310058, CHINA.;COLLEGE OF ENVIRONMENTAL & NATURAL RESOURCES, ZHEJIANG UNIVERSITY, HANGZHOU, 310058","NA","NA"
"8427","SUN Q;WANG T;HUANG J;GU X;DONG Y;YANG Y;DA X;MO X;XIE X;JIANG H;YAN D;ZHENG B;HE Y","SUN, QIUMIN;WANG, TAO;HUANG, JIU;GU, XINYI;DONG, YANLING;YANG, YING;DA, XIAOWEN;MO, XIAORONG;XIE, XIAOTING;JIANG, HANGJIN;YAN, DAOLIANG;ZHENG, BINGSONG;HE, YI",NA,"PLANTS (BASEL, SWITZERLAND)","SWITZERLAND","ENG","JOURNAL ARTICLE","4,8-DHT;ANTIOXIDANT ENZYMES;HERBICIDES;PHOTOSYNTHESIS","","","4,8-DIHYDROXY-L-TETRALONE (4,8-DHT) IS AN ALLELOCHEMICAL ISOLATED FROM THE OUTER BARK OF   THAT ACTS AS A PLANT GROWTH INHIBITOR. IN ORDER TO EXPLORE THE MECHANISM OF 4,8-DHT INHIBITING WEED ACTIVITY, WE TREATED THREE SPECIES OF  ,   AND   WITH DIFFERENT CONCENTRATIONS OF 4,8-DHT AND PERFORMED PHENOTYPE OBSERVATION AND TRANSCRIPTOME SEQUENCING. THE RESULTS SHOWED THAT WITH AN INCREASE IN 4,8-DHT CONCENTRATION, THE DEGREE OF PLANT DAMAGE GRADUALLY DEEPENED. UNDER THE SAME CONCENTRATION OF 4,8-DHT, THE DAMAGE DEGREE OF LEAVES AND ROOTS OF   WAS THE GREATEST, FOLLOWED BY  , WHILE   HAD THE LEAST DAMAGE, AND THE LEAVES TURNED SLIGHTLY YELLOW. TRANSCRIPTOME DATA SHOWED THAT 24536, 9913, AND 1662 DIFFERENTIALLY EXPRESSED GENES (DEGS) WERE IDENTIFIED IN  ,   AND  , RESPECTIVELY. THESE DEGS WERE SIGNIFICANTLY ENRICHED IN PHOTOSYNTHESIS, CARBON FIXATION, GLUTATHIONE METABOLISM, PHENYLPROPANOID BIOSYNTHESIS, AND OXIDATIVE PHOSPHORYLATION PATHWAYS. IN ADDITION, DEGS WERE ALSO ENRICHED IN PLANT HORMONE SIGNAL TRANSDUCTION AND THE MAPK SIGNAL PATHWAY IN  . FURTHER ANALYSIS SHOWED THAT AFTER 4,8-DHT TREATMENT, THE TRANSCRIPT LEVELS OF PHOTOSYNTHESIS PSI- AND PSII-RELATED GENES, LHCA/B-RELATED GENES, RUBISCO, AND PEPC WERE SIGNIFICANTLY DECREASED IN   AND  . AT THE SAME TIME, THE TRANSCRIPTION LEVELS OF GENES RELATED TO GLUTATHIONE METABOLISM AND THE PHENYLPROPANOID BIOSYNTHESIS PATHWAY IN   WERE ALSO SIGNIFICANTLY DECREASED. HOWEVER, THE EXPRESSION OF THESE GENES WAS UPREGULATED IN   AND  . THESE INDICATED THAT 4,8-DHT AFFECTED THE GROWTH OF THE THREE PLANTS THROUGH DIFFERENT PHYSIOLOGICAL PATHWAYS, AND THEN PLAYED A ROLE IN INHIBITING PLANT GROWTH. SIMULTANEOUSLY, THE EXTENT TO WHICH PLANTS WERE AFFECTED DEPENDED ON THE TESTED PLANTS AND THE CONTENT OF 4,8-DHT. THE IDENTIFICATION OF WEED GENES THAT RESPOND TO 4,8-DHT HAS HELPED US TO FURTHER UNDERSTAND THE INHIBITION OF PLANT GROWTH BY ALLELOCHEMICALS AND HAS PROVIDED A SCIENTIFIC BASIS FOR THE DEVELOPMENT OF ALLELOCHEMICALS AS HERBICIDES.","STATE KEY LABORATORY OF SUBTROPICAL SILVICULTURE, ZHEJIANG A&F UNIVERSITY, HANGZHOU 311300, CHINA.;ZHEJIANG PROVINCIAL KEY LABORATORY OF FOREST AROMATIC PLANTS-BASED HEALTHCARE FUNCTIONS, ZHEJIANG A&F UNIVERSITY, HANGZHOU 311300, CHINA.;STATE KEY LABORATORY OF SUBTROPICAL SILVICULTURE, ZHEJIANG A&F UNIVERSITY, HANGZHOU 311300, CHINA.;ZHEJIANG PROVINCIAL KEY LABORATORY OF FOREST AROMATIC PLANTS-BASED HEALTHCARE FUNCTIONS, ZHEJIANG A&F UNIVERSITY, HANGZHOU 311300, CHINA.;SCHOOL OF ENVIRONMENT SCIENCE AND SPATIAL INFORMATICS, CHINA UNIVERSITY OF MINING AND TECHNOLOGY, XUZHOU 221116, CHINA.;STATE KEY LABORATORY OF SUBTROPICAL SILVICULTURE, ZHEJIANG A&F UNIVERSITY, HANGZHOU 311300, CHINA.;ZHEJIANG PROVINCIAL KEY LABORATORY OF FOREST AROMATIC PLANTS-BASED HEALTHCARE FUNCTIONS, ZHEJIANG A&F UNIVERSITY, HANGZHOU 311300, CHINA.;STATE KEY LABORATORY OF SUBTROPICAL SILVICULTURE, ZHEJIANG A&F UNIVERSITY, HANGZHOU 311300, CHINA.;ZHEJIANG PROVINCIAL KEY LABORATORY OF FOREST AROMATIC PLANTS-BASED HEALTHCARE FUNCTIONS, ZHEJIANG A&F UNIVERSITY, HANGZHOU 311300, CHINA.;STATE KEY LABORATORY OF SUBTROPICAL SILVICULTURE, ZHEJIANG A&F UNIVERSITY, HANGZHOU 311300, CHINA.;STATE KEY LABORATORY OF PLANT PHYSIOLOGY AND BIOCHEMISTRY, COLLEGE OF LIFE SCIENCE, ZHEJIANG UNIVERSITY, HANGZHOU 310058, CHINA.;STATE KEY LABORATORY OF PLANT PHYSIOLOGY AND BIOCHEMISTRY, COLLEGE OF LIFE SCIENCE, ZHEJIANG UNIVERSITY, HANGZHOU 310058, CHINA.;STATE KEY LABORATORY OF SUBTROPICAL SILVICULTURE, ZHEJIANG A&F UNIVERSITY, HANGZHOU 311300, CHINA.;CENTER FOR DATA SCIENCE, ZHEJIANG UNIVERSITY, HANGZHOU 310058, CHINA.;STATE KEY LABORATORY OF SUBTROPICAL SILVICULTURE, ZHEJIANG A&F UNIVERSITY, HANGZHOU 311300, CHINA.;ZHEJIANG PROVINCIAL KEY LABORATORY OF FOREST AROMATIC PLANTS-BASED HEALTHCARE FUNCTIONS, ZHEJIANG A&F UNIVERSITY, HANGZHOU 311300, CHINA.;STATE KEY LABORATORY OF SUBTROPICAL SILVICULTURE, ZHEJIANG A&F UNIVERSITY, HANGZHOU 311300, CHINA.;ZHEJIANG PROVINCIAL KEY LABORATORY OF FOREST AROMATIC PLANTS-BASED HEALTHCARE FUNCTIONS, ZHEJIANG A&F UNIVERSITY, HANGZHOU 311300, CHINA.;STATE KEY LABORATORY OF SUBTROPICAL SILVICULTURE, ZHEJIANG A&F UNIVERSITY, HANGZHOU 311300, CHINA.;ZHEJIANG PROVINCIAL KEY LABORATORY OF FOREST AROMATIC PLANTS-BASED HEALTHCARE FUNCTIONS, ZHEJIANG A&F UNIVERSITY, HANGZHOU 311300, CHINA.","NA",0,"2223-7747","PLANTS (BASEL)","PLANTS (BASEL)",2023,"2023","12","10.3390/plants12142728",NA,"2020YFC1806503;31801273;2018FR049;2019B10014","NATIONAL KEY RESEARCH AND DEVELOPMENT PROJECT;NATIONAL NATURAL SCIENCE FOUNDATION OF CHINA;ZHEJIANG A&F UNIVERSITY SCIENTIFIC RESEARCH AND DEVELOPMENT FUND PROJECT;NINGBO SCIENCE AND TECHNOLOGY INNOVATION 2025 MAJOR PROJECT","37514341","37514341","PUBMED","STATE KEY LABORATORY OF SUBTROPICAL SILVICULTURE, ZHEJIANG A&F UNIVERSITY, HANGZHOU 311300, CHINA.;ZHEJIANG PROVINCIAL KEY LABORATORY OF FOREST AROMATIC PLANTS-BASED HEALTHCARE FUNCTIONS, ZHEJIANG A&F UNIVERSITY, HANGZHOU 311300, CHINA.;STATE KEY LABORATORY OF SUBTROPICAL SILVICULTURE, ZHEJIANG A&F UNIVERSITY, HANGZHOU 311300, CHINA.;ZHEJIANG PROVINCIAL KEY LABORATORY OF FOREST AROMATIC PLANTS-BASED HEALTHCARE FUNCTIONS, ZHEJIANG A&F UNIVERSITY, HANGZHOU 311300, CHINA.;SCHOOL OF ENVIRONMENT SCIENCE AND SPATIAL INFORMATICS, CHINA UNIVERSITY OF MINING AND TECHNOLOGY, XUZHOU 221116, CHINA.;STATE KEY LABORATORY OF SUBTROPICAL SILVICULTURE, ZHEJIANG A&F UNIVERSITY, HANGZHOU 311300, CHINA.;ZHEJIANG PROVINCIAL KEY LABORATORY OF FOREST AROMATIC PLANTS-BASED HEALTHCARE FUNCTIONS, ZHEJIANG A&F UNIVERSITY, HANGZHOU 311300, CHINA.;STATE KEY LABORATORY OF SUBTROPICAL SILVICULTURE, ZHEJIANG A&F UNIVERSITY, HANGZHOU 311300, CHINA.;ZHEJIANG PROVINCIAL KEY LABORATORY OF FOREST AROMATIC PLANTS-BASED HEALTHCARE FUNCTIONS, ZHEJIANG A&F UNIVERSITY, HANGZHOU 311300, CHINA.;STATE KEY LABORATORY OF SUBTROPICAL SILVICULTURE, ZHEJIANG A&F UNIVERSITY, HANGZHOU 311300, CHINA.;STATE KEY LABORATORY OF PLANT PHYSIOLOGY AND BIOCHEMISTRY, COLLEGE OF LIFE SCIENCE, ZHEJIANG UNIVERSITY, HANGZHOU 310058, CHINA.;STATE KEY LABORATORY OF PLANT PHYSIOLOGY AND BIOCHEMISTRY, COLLEGE OF LIFE SCIENCE, ZHEJIANG UNIVERSITY, HANGZHOU 310058, CHINA.;STATE KEY LABORATORY OF SUBTROPICAL SILVICULTURE, ZHEJIANG A&F UNIVERSITY, HANGZHOU 311300, CHINA.;CENTER FOR DATA SCIENCE, ZHEJIANG UNIVERSITY, HANGZHOU 310058, CHINA.;STATE KEY LABORATORY OF SUBTROPICAL SILVICULTURE, ZHEJIANG A&F UNIVERSITY, HANGZHOU 311300, CHINA.;ZHEJIANG PROVINCIAL KEY LABORATORY OF FOREST AROMATIC PLANTS-BASED HEALTHCARE FUNCTIONS, ZHEJIANG A&F UNIVERSITY, HANGZHOU 311300, CHINA.;STATE KEY LABORATORY OF SUBTROPICAL SILVICULTURE, ZHEJIANG A&F UNIVERSITY, HANGZHOU 311300, CHINA.;ZHEJIANG PROVINCIAL KEY LABORATORY OF FOREST AROMATIC PLANTS-BASED HEALTHCARE FUNCTIONS, ZHEJIANG A&F UNIVERSITY, HANGZHOU 311300, CHINA.;STATE KEY LABORATORY OF SUBTROPICAL SILVICULTURE, ZHEJIANG A&F UNIVERSITY, HANGZHOU 311300, CHINA.;ZHEJIANG PROVINCIAL KEY LABORATORY OF FOREST AROMATIC PLANTS-BASED HEALTHCARE FUNCTIONS, ZHEJIANG A&F UNIVERSITY, HANGZHOU 311300, CHINA.","NA","NA"
